,caseid,caseno,claimant,isapproved,respondent,status,isapproved,dateregistered,isapproved,country_clean,country_iso3,extraction_method,registration_year,registration_month,registration_day,miningcase
345,365,ARB/20/27,Barrick (PD) Australia Pty Limited,Y,Independent State of Papua New Guinea,Concluded,Y,2020-08-11 00:00:00,Y,Papua New Guinea,PNG,pycountry,2020,8,11,Yes
346,366,ARB/20/26,Fengzhen Min,Y,Republic of Korea,Pending,Y,2020-08-03 00:00:00,Y,South Korea,,alias,2020,8,3,No
347,368,ARB/20/25,Winshear Gold Corp.,Y,United Republic of Tanzania,Concluded,Y,2020-07-27 00:00:00,Y,"Tanzania, United Republic of",TZA,pycountry,2020,7,27,Yes
348,369,ARB/20/24,Teyliom International and others,Y,Republic of Benin,Pending,Y,2020-07-23 00:00:00,Y,Benin,BEN,pycountry,2020,7,23,No
349,370,CONC/20/1,Barrick (Niugini) Limited,Y,Independent State of Papua New Guinea,Concluded,Y,2020-07-22 00:00:00,Y,Papua New Guinea,PNG,pycountry,2020,7,22,Yes
350,371,ARB/20/23,Coöperatieve Rabobank U.A.,Y,United Mexican States,Concluded,Y,2020-07-14 00:00:00,Y,Mexico,MEX,pycountry,2020,7,14,No
351,372,UNCT/20/2,Carlos Sastre and others,Y,United Mexican States,Concluded,Y,2020-03-03 00:00:00,Y,Mexico,MEX,pycountry,2020,3,3,No
352,373,ARB/20/22,"Macro Trading Co., Ltd.",Y,People's Republic of China,Concluded,Y,2020-06-29 00:00:00,Y,China,CHN,pycountry,2020,6,29,No
353,374,ARB/20/21,AHG Industry GmbH & Co. KG,Y,Republic of Iraq,Pending,Y,2020-06-26 00:00:00,Y,Iraq,IRQ,pycountry,2020,6,26,No
354,376,ARB/20/20,Zaur Leshkasheli and Rosserlane Consultants Limited,Y,Republic of Azerbaijan,Pending,Y,2020-06-25 00:00:00,Y,Azerbaijan,AZE,pycountry,2020,6,25,Yes
355,379,ARB/20/19,"Campos de Pesé, S.A.",Y,Republic of Panama,Concluded,Y,2020-06-15 00:00:00,Y,Panama,PAN,pycountry,2020,6,15,No
356,381,ARB/20/18,Desarrollo Vial de los Andes S.A.C. ,Y,Republic of Peru,Concluded,Y,2020-06-10 00:00:00,Y,Peru,PER,pycountry,2020,6,10,No
357,383,UNCT/20/1,"Odyssey Marine Exploration, Inc.",Y,United Mexican States,Concluded,Y,2019-04-05 00:00:00,Y,Mexico,MEX,pycountry,2019,4,5,Yes
358,385,ARB/20/17,Kansanshi Mining Plc,Y,Republic of Zambia,Concluded,Y,2020-06-04 00:00:00,Y,Zambia,ZMB,pycountry,2020,6,4,Yes
359,386,ARB/20/16,AFC Investment Solutions S.L. ,Y,Republic of Colombia,Concluded,Y,2020-05-20 00:00:00,Y,Colombia,COL,pycountry,2020,5,20,No
360,387,ARB/20/15,EP Wind Project (Rom) Six Ltd.,Y,Romania,Pending,Y,2020-05-19 00:00:00,Y,Romania,ROU,pycountry,2020,5,19,No
361,388,ARB/20/14,SMM Cerro Verde Netherlands B.V.,Y,Republic of Peru,Pending,Y,2020-05-13 00:00:00,Y,Peru,PER,pycountry,2020,5,13,Yes
362,389,UNCT/20/3,"Westmoreland Mining Holdings, LLC",Y,Canada,Concluded,Y,2019-08-12 00:00:00,Y,Canada,CAN,pycountry,2019,8,12,Yes
363,390,ARB/20/13,"Espíritu Santo Holdings, LP and L1bre Holding, LLC",Y,United Mexican States,Concluded,Y,2020-05-11 00:00:00,Y,Mexico,MEX,pycountry,2020,5,11,No
364,391,ARB/20/12,BRIF TRES d.o.o. Beograd and BRIF-TC d.o.o. Beograd,Y,Republic of Serbia,Concluded,Y,2020-04-27 00:00:00,Y,Serbia,SRB,pycountry,2020,4,27,No
365,393,ARB(AF)/20/1,EnviroGold (Las Lagunas) Limited,Y,Dominican Republic,Concluded,Y,2020-04-02 00:00:00,Y,Dominican Republic,DOM,pycountry,2020,4,2,Yes
366,394,ARB/20/11,Peteris Pildegovics and SIA North Star,Y,Kingdom of Norway,Pending,Y,2020-04-01 00:00:00,Y,Norway,NOR,pycountry,2020,4,1,No
367,396,ARB/20/10,Webuild S.p.A. (formerly Salini Impregilo S.p.A.),Y,Republic of Panama,Pending,Y,2020-04-01 00:00:00,Y,Panama,PAN,pycountry,2020,4,1,No
368,397,ARB/20/9,South32 SA Investments Limited,Y,Republic of Colombia,Pending,Y,2020-03-27 00:00:00,Y,Colombia,COL,pycountry,2020,3,27,Yes
369,400,ARB/20/8,Freeport-McMoRan Inc.,Y,Republic of Peru,Pending,Y,2020-03-16 00:00:00,Y,Peru,PER,pycountry,2020,3,16,Yes
370,403,ARB/20/7,"Vercara, LLC (formerly Security Services, LLC, formerly Neustar, Inc.)",Y,Republic of Colombia,Concluded,Y,2020-03-09 00:00:00,Y,Colombia,COL,pycountry,2020,3,9,No
371,404,ARB/20/6,Adria Group B.V. and Adria Group Holding B.V.,Y,Republic of Croatia,Pending,Y,2020-03-02 00:00:00,Y,Croatia,HRV,pycountry,2020,3,2,No
372,405,ARB/20/5,"Telcell Wireless, LLC and International Telcell Cellular, LLC",Y,Georgia,Concluded,Y,2020-02-12 00:00:00,Y,Georgia,GEO,pycountry,2020,2,12,No
373,407,ARB/20/4,Odebrecht Latinvest S.à.r.l.,Y,Republic of Peru,Pending,Y,2020-02-04 00:00:00,Y,Peru,PER,pycountry,2020,2,4,Yes
374,408,ARB/20/3,Hamburg Commercial Bank AG,Y,Italian Republic,Concluded,Y,2020-01-21 00:00:00,Y,Italy,ITA,pycountry,2020,1,21,No
375,409,ARB/20/2,Hope Services LLC,Y,Republic of Cameroon,Concluded,Y,2020-01-13 00:00:00,Y,Cameroon,CMR,pycountry,2020,1,13,No
376,410,ARB/20/1,United Agencies Limited SA,Y,People’s Democratic Republic of Algeria,Concluded,Y,2020-01-09 00:00:00,Y,Algeria,DZA,embedded_pycountry,2020,1,9,No
377,411,ARB/19/35,Marko Mihaljevic,Y,Republic of Croatia,Concluded,Y,2019-12-31 00:00:00,Y,Croatia,HRV,pycountry,2019,12,31,No
378,412,ARB/19/34,"Amec Foster Wheeler USA Corporation, Process Consultants, Inc., and Joint Venture Foster Wheeler USA Corporation and Process Consultants, Inc. ",Y,Republic of Colombia,Pending,Y,2019-12-31 00:00:00,Y,Colombia,COL,pycountry,2019,12,31,Yes
379,414,ARB/19/33,Société Générale S.A.,Y,Republic of Croatia,Pending,Y,2019-12-20 00:00:00,Y,Croatia,HRV,pycountry,2019,12,20,No
380,416,ARB/19/32,DSG Yapi Sanayi Ticaret Anonim Sirketi,Y,Kingdom of Saudi Arabia,Concluded,Y,2019-11-21 00:00:00,Y,Saudi Arabia,SAU,pycountry,2019,11,21,No
381,417,ARB/19/31,Gerald International Limited,Y,Republic of Sierra Leone,Concluded,Y,2019-11-01 00:00:00,Y,Sierra Leone,SLE,pycountry,2019,11,1,Yes
382,418,ARB(AF)/19/3,"The Williams Companies International Holdings B.V., WilPro Energy Services (El Furrial) Limited and WilPro Energy Services (Pigap II) Limited",Y,Bolivarian Republic of Venezuela,Pending,Y,2019-10-16 00:00:00,Y,"Venezuela, Bolivarian Republic of",VEN,pycountry,2019,10,16,Yes
383,419,ARB/19/30,VM Solar Jerez GmbH,Y,Kingdom of Spain,Pending,Y,2019-10-04 00:00:00,Y,Spain,ESP,pycountry,2019,10,4,No
384,420,ARB/19/29,"Strabag SE, Erste Nordsee-Offshore Holding GmbH and Zweite Nordsee-Offshore Holding GmbH",Y,Federal Republic of Germany,Pending,Y,2019-09-20 00:00:00,Y,Germany,DEU,pycountry,2019,9,20,No
385,423,ARB/19/28,Latam Hydro LLC and CH Mamacocha S.R.L.,Y,Republic of Peru,Concluded,Y,2019-09-19 00:00:00,Y,Peru,PER,pycountry,2019,9,19,No
386,424,ARB/19/27,CTIP Oil & Gas International Limited,Y,Arab Republic of Egypt,Concluded,Y,2019-09-17 00:00:00,Y,Egypt,EGY,pycountry,2019,9,17,Yes
387,425,ARB/19/26,Terence Highlands,Y,United Mexican States,Pending,Y,2019-09-17 00:00:00,Y,Mexico,MEX,pycountry,2019,9,17,No
388,426,ARB/19/25,Orazul International España Holdings S.L.,Y,Argentine Republic,Concluded,Y,2019-09-11 00:00:00,Y,Argentina,ARG,pycountry,2019,9,11,No
389,427,ARB/19/24,AAN Digital Services Holding Company (KSC),Y,Democratic Republic of the Congo,Concluded,Y,2019-09-11 00:00:00,Y,Congo,COG,embedded_pycountry,2019,9,11,No
390,428,ARB/19/23,"Sapec, S.A.",Y,Kingdom of Spain,Concluded,Y,2019-08-06 00:00:00,Y,Spain,ESP,pycountry,2019,8,6,No
391,429,ARB(AF)/19/2,Gustavo Maeso Lando,Y,Bolivarian Republic of Venezuela,Concluded,Y,2019-08-05 00:00:00,Y,"Venezuela, Bolivarian Republic of",VEN,pycountry,2019,8,5,No
392,431,ARB/19/22,"Glencore International A.G., C. I. Prodeco S.A., and Sociedad Portuaria Puerto Nuevo S.A.",Y,Republic of Colombia,Pending,Y,2019-07-09 00:00:00,Y,Colombia,COL,pycountry,2019,7,9,No
393,433,ARB/19/21,Petrochemical Holding GmbH,Y,Romania,Pending,Y,2019-07-09 00:00:00,Y,Romania,ROU,pycountry,2019,7,9,Yes
394,435,ARB/19/20,Ayat Nizar Raja Sumrain and others,Y,State of Kuwait,Concluded,Y,2019-06-30 00:00:00,Y,Kuwait,KWT,pycountry,2019,6,30,No
395,436,ARB/19/19,IC Power Ltd and Kenon Holdings Ltd,Y,Republic of Peru,Pending,Y,2019-06-27 00:00:00,Y,Peru,PER,pycountry,2019,6,27,No
397,442,ARB/19/17,"Richard N. Westbury, Paul D. Hinks and Symbion Power Tanzania Limited",Y,United Republic of Tanzania,Concluded,Y,2019-05-31 00:00:00,Y,"Tanzania, United Republic of",TZA,pycountry,2019,5,31,No
399,444,ARB/19/16,Latin American Regional Aviation Holding S. de R.L.,Y,Oriental Republic of Uruguay,Concluded,Y,2019-05-23 00:00:00,Y,Uruguay,URY,embedded_pycountry,2019,5,23,No
400,445,ARB/19/15,Axiata Investments (UK) Limited and Ncell Private Limited,Y,Nepal,Concluded,Y,2019-05-20 00:00:00,Y,Nepal,NPL,pycountry,2019,5,20,No
401,446,ARB/19/14,Impresa Pizzarotti & C. S.p.A.,Y,Kingdom of Morocco,Concluded,Y,2019-05-20 00:00:00,Y,Morocco,MAR,pycountry,2019,5,20,No
402,447,ARB/19/13,Alejandro Diego Díaz Gaspar,Y,Republic of Costa Rica,Concluded,Y,2019-05-01 00:00:00,Y,Costa Rica,CRI,pycountry,2019,5,1,No
403,448,ARB/19/12,Kornikom EOOD,Y,Republic of Serbia,Concluded,Y,2019-04-30 00:00:00,Y,Serbia,SRB,pycountry,2019,4,30,Yes
404,449,ARB/19/11,Nationale-Nederlanden Holdinvest B.V. and others,Y,Argentine Republic,Pending,Y,2019-04-30 00:00:00,Y,Argentina,ARG,pycountry,2019,4,30,No
405,450,ARB/19/10,Shokat Mohammed Dalal,Y,United Arab Emirates,Concluded,Y,2019-04-25 00:00:00,Y,United Arab Emirates,ARE,pycountry,2019,4,25,No
406,451,ARB/19/9,Artem Skubenko and others,Y,Republic of North Macedonia,Concluded,Y,2019-04-25 00:00:00,Y,North Macedonia,MKD,pycountry,2019,4,25,Yes
407,452,ARB/19/8,Ayoub-Farid Michel Saab,Y,United Republic of Tanzania,Concluded,Y,2019-04-16 00:00:00,Y,"Tanzania, United Republic of",TZA,pycountry,2019,4,16,No
408,453,ARB/19/7,Petroceltic Holdings Limited and Petroceltic Resources Limited,Y,Arab Republic of Egypt,Concluded,Y,2019-04-04 00:00:00,Y,Egypt,EGY,pycountry,2019,4,4,Yes
409,454,ARB/19/6,Angel Samuel Seda and others,Y,Republic of Colombia,Pending,Y,2019-03-25 00:00:00,Y,Colombia,COL,pycountry,2019,3,25,No
410,456,ARB/19/5,Enel Fortuna S.A.,Y,Republic of Panama,Concluded,Y,2019-03-07 00:00:00,Y,Panama,PAN,pycountry,2019,3,7,No
411,457,ARB/19/4,"Canepa Green Energy Opportunities I, S.à r.l. and Canepa Green Energy Opportunities II, S.à r.l.",Y,Kingdom of Spain,Pending,Y,2019-02-25 00:00:00,Y,Spain,ESP,pycountry,2019,2,25,No
412,459,ARB(AF)/19/1,Alois Schönberger,Y,Republic of Tajikistan,Concluded,Y,2019-02-15 00:00:00,Y,Tajikistan,TJK,pycountry,2019,2,15,No
413,460,UNCT/18/4,Alicia Grace and others,Y,United Mexican States,Concluded,Y,2018-06-19 00:00:00,Y,Mexico,MEX,pycountry,2018,6,19,Yes
415,462,ARB/19/2,Scholz Holding GmbH,Y,Kingdom of Morocco,Concluded,Y,2019-01-03 00:00:00,Y,Morocco,MAR,pycountry,2019,1,3,No
416,463,ARB/19/1,"Legacy Vulcan, LLC",Y,United Mexican States,Pending,Y,2019-01-03 00:00:00,Y,Mexico,MEX,pycountry,2019,1,3,Yes
417,464,ARB/18/49,Smurfit Holdings B.V.,Y,Bolivarian Republic of Venezuela,Pending,Y,2018-12-28 00:00:00,Y,"Venezuela, Bolivarian Republic of",VEN,pycountry,2018,12,28,No
418,466,ARB/18/48,Hydrika 1 S.A.C. and others,Y,Republic of Peru,Concluded,Y,2018-12-28 00:00:00,Y,Peru,PER,pycountry,2018,12,28,No
419,467,ARB/18/47,Rami Levy and others,Y,Republic of Bulgaria,Pending,Y,2018-12-27 00:00:00,Y,Bulgaria,BGR,pycountry,2018,12,27,No
420,469,ARB/18/46,"Westwater Resources, Inc.",Y,Republic of Türkiye,Concluded,Y,2018-12-21 00:00:00,Y,Türkiye,TUR,pycountry,2018,12,21,Yes
421,471,ARB/18/45,European Solar Farms A/S,Y,Kingdom of Spain,Pending,Y,2018-12-21 00:00:00,Y,Spain,ESP,pycountry,2018,12,21,No
422,473,ARB/18/44,SAUR and STEREAU,Y,People’s Democratic Republic of Algeria ,Concluded,Y,2018-12-12 00:00:00,Y,Algeria,DZA,embedded_pycountry,2018,12,12,No
423,474,ARB/18/43,"Daniel W. Kappes and Kappes, Cassiday & Associates",Y,Republic of Guatemala,Concluded,Y,2018-12-11 00:00:00,Y,Guatemala,GTM,pycountry,2018,12,11,Yes
424,475,UNCT/18/5,PACC Offshore Services Holdings Ltd,Y,United Mexican States,Concluded,Y,2018-05-04 00:00:00,Y,Mexico,MEX,pycountry,2018,5,4,No
425,476,ARB/18/42,EBL (Genossenschaft Elektra Baselland) and Tubo Sol PE2 S.L.,Y,Kingdom of Spain,Concluded,Y,2018-11-08 00:00:00,Y,Spain,ESP,pycountry,2018,11,8,No
426,477,ARB(AF)/18/6,Dick Fernando Abanto Ishivata,Y,Bolivarian Republic of Venezuela,Concluded,Y,2018-11-06 00:00:00,Y,"Venezuela, Bolivarian Republic of",VEN,pycountry,2018,11,6,No
427,478,ARB/18/41,Alexander Nelin,Y,Republic of Cyprus,Concluded,Y,2018-11-02 00:00:00,Y,Cyprus,CYP,pycountry,2018,11,2,No
428,479,ARB/18/40,"Inversiones Continental (Panamá), S.A.",Y,Republic of Honduras,Pending,Y,2018-10-30 00:00:00,Y,Honduras,HND,pycountry,2018,10,30,No
429,480,UNCT/18/3,Michael Anthony Lee-Chin,Y,Dominican Republic,Concluded,Y,2018-04-06 00:00:00,Y,Dominican Republic,DOM,pycountry,2018,4,6,No
430,482,ARB/18/39,KLS Energy Lanka Sdn. Bhd. and KLS Energy Lanka (Private) Ltd,Y,Democratic Socialist Republic of Sri Lanka,Concluded,Y,2018-10-24 00:00:00,Y,Sri Lanka,LKA,pycountry,2018,10,24,No
431,483,ARB/18/38,"Talal Al Awamleh, Arab Telemedia Services LLC and Ain Telemedia Studios LLC",Y,State of Qatar,Concluded,Y,2018-10-17 00:00:00,Y,Qatar,QAT,pycountry,2018,10,17,No
432,484,ARB/18/37,Oļegs Roščins,Y,Republic of Lithuania,Concluded,Y,2018-10-16 00:00:00,Y,Lithuania,LTU,pycountry,2018,10,16,No
433,485,ARB/18/36,Société d’Energie et d’Eau du Gabon and Veolia Africa,Y,"Gabonese Republic and Société de Patrimoine du service public de l’eau potable, de l’énergie électrique et de l’assainissement",Concluded,Y,2018-10-16 00:00:00,Y,Gabon,GAB,embedded_alias,2018,10,16,No
434,486,ARB/18/35,Dirk Herzig as Insolvency Administrator over the Assets of Unionmatex Industrieanlagen GmbH,Y,Turkmenistan,Concluded,Y,2018-10-12 00:00:00,Y,Turkmenistan,TKM,pycountry,2018,10,12,No
435,487,ARB/18/34,SECE İnşaat ve Ticaret A.Ş.,Y,Turkmenistan,Concluded,Y,2018-10-12 00:00:00,Y,Turkmenistan,TKM,pycountry,2018,10,12,No
436,488,ARB/18/33,"GBM Global, S.A. de C.V., Fondo de Inversión de Renta Variable and others",Y,Kingdom of Spain,Concluded,Y,2018-10-04 00:00:00,Y,Spain,ESP,pycountry,2018,10,4,No
437,489,ARB/18/32,AS Windoor,Y,Republic of Kazakhstan,Pending,Y,2018-09-28 00:00:00,Y,Kazakhstan,KAZ,pycountry,2018,9,28,No
438,491,ARB/18/31,International Holding Project Group and others,Y,Arab Republic of Egypt,Pending,Y,2018-09-19 00:00:00,Y,Egypt,EGY,pycountry,2018,9,19,No
439,494,UNCT/18/1,"Naturgy Energy Group, S.A. and Naturgy Electricidad Colombia, S.L. (formerly Gas Natural SDG, S.A. and Gas Natural Fenosa Electricidad Colombia, S.L.) ",Y,Republic of Colombia,Concluded,Y,2017-03-21 00:00:00,Y,Colombia,COL,pycountry,2017,3,21,No
440,495,ARB/18/30,Alverley Investments Limited and Germen Properties Ltd,Y,Romania,Concluded,Y,2018-08-23 00:00:00,Y,Romania,ROU,pycountry,2018,8,23,No
441,496,ARB/18/29,The Carlyle Group L.P. and others,Y,Kingdom of Morocco,Concluded,Y,2018-08-22 00:00:00,Y,Morocco,MAR,pycountry,2018,8,22,Yes
442,497,ARB(AF)/18/5,Banco Bilbao Vizcaya Argentaria S.A.,Y,Plurinational State of Bolivia,Concluded,Y,2018-08-20 00:00:00,Y,"Bolivia, Plurinational State of",BOL,pycountry,2018,8,20,No
443,498,ADM/18/1 and SCC Case No. V2018/039,"Gardabani Holdings B.V., Inter RAO UES PJSC, Telasi JSC",Y,"Government of Georgia, Ministry of Economy and Sustainable Development of Georgia, State Service Bureau Ltd",Concluded,Y,2018-07-09 00:00:00,Y,Georgia,GEO,embedded_pycountry,2018,7,9,No
444,499,ARB(AF)/18/4,Public Joint Stock Company Mobile TeleSystems ,Y,Turkmenistan ,Concluded,Y,2018-08-10 00:00:00,Y,Turkmenistan,TKM,pycountry,2018,8,10,No
445,500,ARB/18/28,Rasia FZE and Joseph K. Borkowski,Y,Republic of Armenia,Concluded,Y,2018-08-03 00:00:00,Y,Armenia,ARM,pycountry,2018,8,3,No
446,502,ARB/18/27,Sociedad Aeroportuaria Kuntur Wasi S.A. and Corporación América S.A.,Y,Republic of Peru,Concluded,Y,2018-07-27 00:00:00,Y,Peru,PER,pycountry,2018,7,27,No
447,503,ARB/18/26,ENAGÁS S.A. (España) and ENAGÁS Internacional S.L.U. (España),Y,Republic of Peru,Pending,Y,2018-07-24 00:00:00,Y,Peru,PER,pycountry,2018,7,24,Yes
448,506,UNCT/18/2,Gramercy Funds Management LLC and Gramercy Peru Holdings LLC,Y,Republic of Peru,Concluded,Y,2016-06-02 00:00:00,Y,Peru,PER,pycountry,2016,6,2,No
449,507,ARB/18/25,ITOCHU Corporation,Y,Kingdom of Spain,Pending,Y,2018-07-13 00:00:00,Y,Spain,ESP,pycountry,2018,7,13,No
450,509,ARB/18/24,African Petroleum Senegal Limited,Y,Republic of Senegal,Concluded,Y,2018-07-11 00:00:00,Y,Senegal,SEN,pycountry,2018,7,11,Yes
451,510,ARB/18/23,Aris Mining Corporation (formerly known as GCM Mining Corp. and Gran Colombia Gold Corp.),Y,Republic of Colombia,Concluded,Y,2018-07-02 00:00:00,Y,Colombia,COL,pycountry,2018,7,2,Yes
452,511,ARB/18/22,Tantalum International Ltd. and Emerge Gaming Ltd.,Y,Arab Republic of Egypt,Concluded,Y,2018-06-28 00:00:00,Y,Egypt,EGY,pycountry,2018,6,28,Yes
453,512,ARB/18/21,Bay View Group LLC and The Spalena Company LLC,Y,Republic of Rwanda,Concluded,Y,2018-06-22 00:00:00,Y,Rwanda,RWA,embedded_pycountry,2018,6,22,Yes
454,513,ARB/18/20,Veolia Propreté SAS,Y,Italian Republic,Concluded,Y,2018-06-20 00:00:00,Y,Italy,ITA,pycountry,2018,6,20,No
455,515,ARB/18/19,LSG Building Solutions GmbH and others,Y,Romania,Concluded,Y,2018-06-12 00:00:00,Y,Romania,ROU,pycountry,2018,6,12,No
456,517,ARB/18/18,Ipek Investment Limited,Y,Republic of Türkiye,Concluded,Y,2018-05-29 00:00:00,Y,Türkiye,TUR,pycountry,2018,5,29,Yes
457,518,ARB/18/17,Autopista del Norte S.A.C.,Y,Republic of Peru,Concluded,Y,2018-05-18 00:00:00,Y,Peru,PER,pycountry,2018,5,18,No
458,520,ARB/18/16,Togo Terminal ,Y,Republic of Togo,Concluded,Y,2018-05-14 00:00:00,Y,Togo,TGO,embedded_pycountry,2018,5,14,No
459,521,ARB/18/15,NEPC Consortium Power Limited ,Y,Bangladesh Power Development Board,Concluded,Y,2018-05-14 00:00:00,Y,Bangladesh,BGD,embedded_pycountry,2018,5,14,No
460,522,ARB/18/14,HOCHTIEF Infrastructure GmbH,Y,Kingdom of Saudi Arabia,Concluded,Y,2018-05-03 00:00:00,Y,Saudi Arabia,SAU,pycountry,2018,5,3,No
461,523,ARB/18/13,Montauk Metals Inc. (formerly known as Galway Gold Inc.),Y,Republic of Colombia,Concluded,Y,2018-04-18 00:00:00,Y,Colombia,COL,pycountry,2018,4,18,Yes
462,524,ARB/18/12,Red Eagle Exploration Limited,Y,Republic of Colombia,Concluded,Y,2018-04-18 00:00:00,Y,Colombia,COL,pycountry,2018,4,18,Yes
463,525,ARB(AF)/18/3,"Kimberly-Clark Dutch Holdings, B.V., Kimberly-Clark S.L.U., and Kimberly-Clark BVBA",Y,Bolivarian Republic of Venezuela,Concluded,Y,2018-04-17 00:00:00,Y,"Venezuela, Bolivarian Republic of",VEN,pycountry,2018,4,17,No
464,526,ARB/18/11,Société des Parcs d’Alger and Emirates International Investment Company LLC,Y,People’s Democratic Republic of Algeria ,Concluded,Y,2018-04-05 00:00:00,Y,Algeria,DZA,embedded_pycountry,2018,4,5,No
465,527,CONC/18/1,Société d’Energie et d’Eau du Gabon,Y,Gabonese Republic,Concluded,Y,2018-03-30 00:00:00,Y,Gabon,GAB,alias,2018,3,30,No
466,528,ARB/18/10,"West African Aquaculture Ltd, Kurt Lennart Hansson and Martje Bolt Hansson",Y,Republic of The Gambia,Pending,Y,2018-03-28 00:00:00,Y,Gambia,GMB,pycountry,2018,3,28,No
467,530,ARB/18/9,Delta Belarus Holding BV,Y,Republic of Belarus,Concluded,Y,2018-03-22 00:00:00,Y,Belarus,BLR,pycountry,2018,3,22,No
468,531,ARB/18/8,Rand Investments Ltd. and others,Y,Republic of Serbia,Concluded,Y,2018-03-22 00:00:00,Y,Serbia,SRB,pycountry,2018,3,22,No
469,534,ARB(AF)/18/2,Shin Dong Baig,Y,Socialist Republic of Vietnam,Concluded,Y,2018-03-19 00:00:00,Y,Viet Nam,VNM,embedded_pycountry,2018,3,19,No
470,535,ARB/18/7,Corral Morocco Holdings AB,Y,Kingdom of Morocco,Pending,Y,2018-03-14 00:00:00,Y,Morocco,MAR,pycountry,2018,3,14,Yes
471,539,ARB/18/6,Cem Selçuk Ersoy,Y,Republic of Azerbaijan ,Concluded,Y,2018-03-14 00:00:00,Y,Azerbaijan,AZE,pycountry,2018,3,14,No
472,540,ARB/18/5,Astrida Benita Carrizosa,Y,Republic of Colombia,Concluded,Y,2018-03-09 00:00:00,Y,Colombia,COL,pycountry,2018,3,9,No
473,541,ARB/18/4,Cascade Investments NV,Y,Republic of Turkey,Concluded,Y,2018-02-28 00:00:00,Y,Turkey,,alias,2018,2,28,No
474,542,ARB/18/3,"Telefónica, S.A.",Y,Republic of Colombia,Pending,Y,2018-02-20 00:00:00,Y,Colombia,COL,pycountry,2018,2,20,No
475,544,ARB/18/2,Almasryia for Operating & Maintaining Touristic Construction Co. L.L.C.,Y,State of Kuwait,Concluded,Y,2018-02-14 00:00:00,Y,Kuwait,KWT,pycountry,2018,2,14,No
476,546,ARB/18/1,ACF Renewable Energy Limited,Y,Republic of Bulgaria,Concluded,Y,2018-02-14 00:00:00,Y,Bulgaria,BGR,pycountry,2018,2,14,No
477,547,ARB(AF)/18/1,GRAND EXPRESS Non-Public Joint Stock Company,Y,Republic of Belarus,Concluded,Y,2018-01-31 00:00:00,Y,Belarus,BLR,pycountry,2018,1,31,No
478,548,ARB/17/49,Erste Group Bank AG and others,Y,Republic of Croatia,Concluded,Y,2017-12-29 00:00:00,Y,Croatia,HRV,pycountry,2017,12,29,No
479,549,ARB/17/48,"Wise Solutions CDI, SA",Y,Republic of Côte d'Ivoire,Concluded,Y,2017-12-29 00:00:00,Y,Côte d'Ivoire,CIV,pycountry,2017,12,29,No
480,550,ARB/17/47,AS PNB Banka and others,Y,Republic of Latvia,Pending,Y,2017-12-28 00:00:00,Y,Latvia,LVA,pycountry,2017,12,28,No
481,551,ARB/17/46,Cunico Resources N.V.,Y,Republic of North Macedonia,Concluded,Y,2017-12-21 00:00:00,Y,North Macedonia,MKD,pycountry,2017,12,21,No
482,552,ARB/17/45,Mazen Al Ramahi,Y,Hungary,Concluded,Y,2017-12-21 00:00:00,Y,Hungary,HUN,pycountry,2017,12,21,No
483,553,ARB/17/44,The Lopez-Goyne Family Trust and others,Y,Republic of Nicaragua ,Concluded,Y,2017-12-19 00:00:00,Y,Nicaragua,NIC,pycountry,2017,12,19,Yes
484,555,ARB/17/43,"Samsung Engineering Co., Ltd.",Y,Kingdom of Saudi Arabia,Concluded,Y,2017-11-10 00:00:00,Y,Saudi Arabia,SAU,pycountry,2017,11,10,No
485,556,ARB/17/42,MAKAE Europe SARL,Y,Kingdom of Saudi Arabia,Concluded,Y,2017-11-08 00:00:00,Y,Saudi Arabia,SAU,pycountry,2017,11,8,No
486,557,ARB/17/41,DCM Energy GmbH & Co. Solar 1 KG and others,Y,Kingdom of Spain,Concluded,Y,2017-10-31 00:00:00,Y,Spain,ESP,pycountry,2017,10,31,No
487,558,ARB/17/40,APCL Gambia B.V.,Y,Republic of The Gambia,Concluded,Y,2017-10-17 00:00:00,Y,Gambia,GMB,pycountry,2017,10,17,Yes
488,559,ARB/17/39,African Petroleum Gambia Limited and APCL Gambia B.V.,Y,Republic of The Gambia,Concluded,Y,2017-10-17 00:00:00,Y,Gambia,GMB,pycountry,2017,10,17,Yes
489,560,ARB/17/38,Petronor E&P Gambia Limited and APCL Gambia B.V. ,Y,Republic of The Gambia,Concluded,Y,2017-10-17 00:00:00,Y,Gambia,GMB,pycountry,2017,10,17,Yes
490,561,ARB/17/37,Addiko Bank AG and Addiko Bank d.d.,Y,Republic of Croatia,Pending,Y,2017-09-27 00:00:00,Y,Croatia,HRV,pycountry,2017,9,27,No
491,562,ARB/17/36,Edmond Khudyan and Arin Capital & Investment Corp.,Y,Republic of Armenia,Concluded,Y,2017-09-27 00:00:00,Y,Armenia,ARM,pycountry,2017,9,27,No
492,564,ARB(AF)/17/4,Venoklim Holding B.V.,Y,Bolivarian Republic of Venezuela,Concluded,Y,2017-09-25 00:00:00,Y,"Venezuela, Bolivarian Republic of",VEN,pycountry,2017,9,25,No
493,565,ARB/17/35,Addiko Bank AG,Y,Montenegro,Concluded,Y,2017-09-19 00:00:00,Y,Montenegro,MNE,pycountry,2017,9,19,No
494,566,ARB(AF)/17/3,"Vento Motorcycles, Inc.",Y,United Mexican States,Concluded,Y,2017-09-15 00:00:00,Y,Mexico,MEX,pycountry,2017,9,15,No
495,567,ARB/17/34,Raiffeisen Bank International AG and Raiffeisenbank Austria d.d.,Y,Republic of Croatia,Concluded,Y,2017-09-15 00:00:00,Y,Croatia,HRV,pycountry,2017,9,15,No
496,568,ARB/17/33,EcoDevelopment in Europe AB and EcoEnergy Africa AB,Y,United Republic of Tanzania,Concluded,Y,2017-09-11 00:00:00,Y,"Tanzania, United Republic of",TZA,pycountry,2017,9,11,No
497,570,ARB/17/32,Elitech B.V. and Razvoj Golf D.O.O.,Y,Republic of Croatia,Concluded,Y,2017-09-06 00:00:00,Y,Croatia,HRV,pycountry,2017,9,6,No
498,571,ARB/17/31,Future Pipe International B.V.,Y,Arab Republic of Egypt,Concluded,Y,2017-08-24 00:00:00,Y,Egypt,EGY,pycountry,2017,8,24,No
499,572,ARB/17/30,Lotus Holding Anonim Şirketi,Y,Turkmenistan,Concluded,Y,2017-08-22 00:00:00,Y,Turkmenistan,TKM,pycountry,2017,8,22,No
500,573,ARB/17/29,Gardabani Holdings B.V. and Silk Road Holdings B.V.,Y,Georgia,Concluded,Y,2017-08-18 00:00:00,Y,Georgia,GEO,pycountry,2017,8,18,No
501,575,ARB(AF)/17/2,Eutelsat S.A.,Y,United Mexican States,Concluded,Y,2017-08-16 00:00:00,Y,Mexico,MEX,pycountry,2017,8,16,No
502,576,ARB/17/28,LTME Mauritius Limited and Madamobil Holdings Mauritius Limited,Y,Republic of Madagascar,Concluded,Y,2017-08-09 00:00:00,Y,Madagascar,MDG,pycountry,2017,8,9,No
503,577,ARB/17/27,"Magyar Farming Company Ltd, Kintyre Kft and Inicia Zrt",Y,Hungary,Concluded,Y,2017-08-01 00:00:00,Y,Hungary,HUN,pycountry,2017,8,1,No
504,579,ARB/17/26,Puma Energy PNG Supply Ltd and Puma Energy PNG Refining Limited,Y,Independent State of Papua New Guinea,Concluded,Y,2017-07-31 00:00:00,Y,Papua New Guinea,PNG,pycountry,2017,7,31,Yes
505,580,ARB/17/25,Mabco Constructions SA,Y,Republic of Kosovo,Concluded,Y,2017-07-21 00:00:00,Y,Kosovo,,alias,2017,7,21,No
506,581,ARB/17/24,"Bursel Tekstil Sanayi Ve Diş Ticaret A.Ş., Burhan Enuştekin and Selim Kaptanoğlu",Y,Republic of Uzbekistan,Concluded,Y,2017-07-19 00:00:00,Y,Uzbekistan,UZB,pycountry,2017,7,19,No
507,582,ARB/17/23,"CMC Muratori Cementisti CMC Di Ravenna SOC. Coop., CMC MuratoriCementisti CMC Di Ravenna SOC. Coop. A.R.L. Maputo Branch and CMC Africa Austral, LDA",Y,Republic of Mozambique,Concluded,Y,2017-07-14 00:00:00,Y,Mozambique,MOZ,pycountry,2017,7,14,No
508,583,ARB/17/22,Big Sky Energy Corporation,Y,Republic of Kazakhstan,Concluded,Y,2017-07-07 00:00:00,Y,Kazakhstan,KAZ,pycountry,2017,7,7,Yes
509,584,ARB/17/21,DP World Limited,Y,Kingdom of Belgium,Pending,Y,2017-06-29 00:00:00,Y,Belgium,BEL,pycountry,2017,6,29,No
510,586,ARB/17/20,BM Mühendislik ve İnşaat A.Ş.,Y,United Arab Emirates,Concluded,Y,2017-06-28 00:00:00,Y,United Arab Emirates,ARE,pycountry,2017,6,28,No
511,589,UNCT/17/1,Joshua Dean Nelson,Y,United Mexican States,Concluded,Y,2016-09-26 00:00:00,Y,Mexico,MEX,pycountry,2016,9,26,No
512,590,ARB/17/19,Hela Schwarz GmbH,Y,People's Republic of China ,Concluded,Y,2017-06-21 00:00:00,Y,China,CHN,pycountry,2017,6,21,No
513,591,ARB/17/18,"(DS)2, S.A., Peter de Sutter and Kristof de Sutter ",Y,Republic of Madagascar,Concluded,Y,2017-06-14 00:00:00,Y,Madagascar,MDG,pycountry,2017,6,14,No
