,caseid,caseno,claimant,isapproved,respondent,status,isapproved,dateregistered,isapproved,country_clean,country_iso3,extraction_method,registration_year,registration_month,registration_day,miningcase
0,1,ARB/26/22,Khalaf Ahmad Mohammad Alhabtoor and others,Y,Lebanese Republic,Pending,Y,2026-05-21 00:00:00,Y,Lebanon,LBN,pycountry,2026,5,21,No
1,2,ARB/26/21,Lansdowne Oil & Gas PLC and Lansdowne Celtic Sea Limited,Y,Ireland,Pending,Y,2026-05-08 00:00:00,Y,Ireland,IRL,pycountry,2026,5,8,Yes
2,3,ARB/26/20,Termocandelaria Power S.A.,Y,Republic of Colombia,Pending,Y,2026-04-27 00:00:00,Y,Colombia,COL,pycountry,2026,4,27,No
3,4,ARB/26/19,Canadian Pacific Kansas City Limited,Y,United Mexican States ,Pending,Y,2026-04-27 00:00:00,Y,Mexico,MEX,pycountry,2026,4,27,No
4,5,ARB/26/18,Ye Cheng and others,Y,Commonwealth of Australia,Pending,Y,2026-04-23 00:00:00,Y,Australia,AUS,embedded_pycountry,2026,4,23,No
5,6,ARB/26/17,Spectrum UA Credit LLC,Y,Ukraine,Pending,Y,2026-04-17 00:00:00,Y,Ukraine,UKR,pycountry,2026,4,17,No
6,7,ARB/26/16,Forty Management AG,Y,Romania,Pending,Y,2026-04-14 00:00:00,Y,Romania,ROU,pycountry,2026,4,14,No
7,8,ARB/26/15,Nagisa Murakami and others,Y,Swiss Confederation,Pending,Y,2026-04-10 00:00:00,Y,Switzerland,CHE,pycountry,2026,4,10,No
8,9,ARB/26/14,Shell Tunisia Upstream Limited and Shell Tunisia LPG S.A.,Y,Republic of Tunisia,Pending,Y,2026-04-07 00:00:00,Y,Tunisia,TUN,pycountry,2026,4,7,Yes
9,10,ARB/26/13,Falcon Energy Materials plc,Y,Republic of Guinea,Pending,Y,2026-03-31 00:00:00,Y,Guinea,GIN,pycountry,2026,3,31,Yes
10,11,ARB/26/12,Sinolam International Pte Ltd,Y,Republic of Panama,Pending,Y,2026-03-16 00:00:00,Y,Panama,PAN,pycountry,2026,3,16,No
11,12,ARB/26/11,Koninklijke Ahold Delhaize N.V. and Delhaize 'The Lion' Nederland B.V.,Y,Republic of Serbia,Pending,Y,2026-03-03 00:00:00,Y,Serbia,SRB,pycountry,2026,3,3,No
12,13,ARB/26/10,Agip Caspian Sea B.V. and others,Y,Republic of Kazakhstan,Pending,Y,2026-02-27 00:00:00,Y,Kazakhstan,KAZ,pycountry,2026,2,27,Yes
13,14,ARB/26/9,Al Oroba for Real Estate Investment Company and others,Y,Arab Republic of Egypt,Pending,Y,2026-02-19 00:00:00,Y,Egypt,EGY,pycountry,2026,2,19,No
14,15,ARB/26/8,Blue Water Worldwide LLC and others,Y,Republic of Peru,Pending,Y,2026-02-10 00:00:00,Y,Peru,PER,pycountry,2026,2,10,No
15,16,ARB(AF)/26/2,Tanganyika Gold S.A.,Y,Republic of Burundi ,Pending,Y,2026-02-05 00:00:00,Y,Burundi,BDI,pycountry,2026,2,5,Yes
16,17,ARB/26/7,Webuild S.p.A.,Y,Argentine Republic,Pending,Y,2026-02-02 00:00:00,Y,Argentina,ARG,pycountry,2026,2,2,No
17,18,ARB/26/6,Igor Viktorovich Makarov,Y,Canada,Pending,Y,2026-01-30 00:00:00,Y,Canada,CAN,pycountry,2026,1,30,Yes
19,20,ARB/26/4,"S-Planning Co., Ltd. and others",Y,Swiss Confederation,Pending,Y,2026-01-16 00:00:00,Y,Switzerland,CHE,pycountry,2026,1,16,No
20,21,ARB/26/2,Shell PLC,Y,Kingdom of the Netherlands ,Pending,Y,2026-01-15 00:00:00,Y,Netherlands,NLD,pycountry,2026,1,15,Yes
21,22,ARB/26/3,Axis International Limited,Y,Republic of Guinea,Pending,Y,2026-01-16 00:00:00,Y,Guinea,GIN,pycountry,2026,1,16,Yes
22,23,ARB/26/1,Hiroshi Osumi,Y,Swiss Confederation,Pending,Y,2026-01-07 00:00:00,Y,Switzerland,CHE,pycountry,2026,1,7,No
23,24,ARB(AF)/26/1,Ntega Holding Burundi S.A.,Y,Republic of Burundi,Pending,Y,2026-01-06 00:00:00,Y,Burundi,BDI,pycountry,2026,1,6,Yes
24,25,ARB/25/56,Nimba Investment LLC and others,Y,Republic of Guinea,Pending,Y,2025-12-22 00:00:00,Y,Guinea,GIN,pycountry,2025,12,22,Yes
25,26,ARB/25/55,Noor Holdings Ltd.,Y,People’s Democratic Republic of Algeria ,Pending,Y,2025-12-18 00:00:00,Y,Algeria,DZA,embedded_pycountry,2025,12,18,No
26,27,ARB/25/54,Travizory Border Security SA,Y,Republic of Kenya,Pending,Y,2025-12-16 00:00:00,Y,Kenya,KEN,pycountry,2025,12,16,No
27,28,ARB(AF)/25/6,"Halliburton (Barbados) Investments S.R.L. and Servicios Halliburton de Venezuela, S.A.",Y,Bolivarian Republic of Venezuela,Pending,Y,2025-12-11 00:00:00,Y,"Venezuela, Bolivarian Republic of",VEN,pycountry,2025,12,11,Yes
28,29,ARB/25/53,EDP Renováveis S.A.,Y,Republic of Colombia,Pending,Y,2025-12-10 00:00:00,Y,Colombia,COL,pycountry,2025,12,10,No
29,30,ARB/25/51,Starcom Holding AD and others,Y,Romania,Pending,Y,2025-11-24 00:00:00,Y,Romania,ROU,pycountry,2025,11,24,No
30,31,ARB/25/52,Mohammed Saiful Alam and others,Y,People's Republic of Bangladesh,Pending,Y,2025-11-25 00:00:00,Y,Bangladesh,BGD,pycountry,2025,11,25,No
31,32,ARB/25/50,Bupa Investments Overseas Limited,Y,Republic of Chile,Pending,Y,2025-11-21 00:00:00,Y,Chile,CHL,pycountry,2025,11,21,No
32,33,ARB/25/49,Aria Capital LLC and Publio Administration LLC,Y,United Mexican States,Pending,Y,2025-11-21 00:00:00,Y,Mexico,MEX,pycountry,2025,11,21,No
33,34,ARB/25/48,Nomad Bauxite Corporation Pte Ltd and Almas Mynbayev,Y,Republic of Guinea,Pending,Y,2025-11-18 00:00:00,Y,Guinea,GIN,pycountry,2025,11,18,Yes
34,35,ARB/25/47,Optim Holding GmbH,Y,Ukraine,Pending,Y,2025-11-05 00:00:00,Y,Ukraine,UKR,pycountry,2025,11,5,No
35,36,ARB/25/46,Ferrer Internacional S.A.,Y,Republic of Ecuador,Pending,Y,2025-10-29 00:00:00,Y,Ecuador,ECU,pycountry,2025,10,29,No
36,37,ARB/25/45,"Yaacov Afik, Michael Mistriel Aykout and Shimon Mistriel Aykout",Y,Republic of Cyprus,Pending,Y,2025-10-06 00:00:00,Y,Cyprus,CYP,pycountry,2025,10,6,No
39,40,ARB/25/42,PanAfrican Energy Corporation,Y,United Republic of Tanzania ,Pending,Y,2025-08-28 00:00:00,Y,"Tanzania, United Republic of",TZA,pycountry,2025,8,28,Yes
40,41,ARB/25/41,Enwell Energy plc,Y,Ukraine,Pending,Y,2025-08-22 00:00:00,Y,Ukraine,UKR,pycountry,2025,8,22,Yes
41,42,ARB/25/40,Buried Hill Serdar Limited,Y,Turkmenistan,Pending,Y,2025-08-12 00:00:00,Y,Turkmenistan,TKM,pycountry,2025,8,12,Yes
42,43,ARB/25/39,Juan Carlos Argüello and Ernesto Argüello,Y,Republic of Panama,Pending,Y,2025-08-11 00:00:00,Y,Panama,PAN,pycountry,2025,8,11,No
43,44,ARB/25/38,Smart Energy B.V. and PJSC Ukrgazvydobutok,Y,Ukraine,Pending,Y,2025-08-11 00:00:00,Y,Ukraine,UKR,pycountry,2025,8,11,Yes
44,45,ARB/25/37,Woodhouse Investment Pte Ltd and West Cumbria Mining (Holdings) Limited,Y,United Kingdom,Pending,Y,2025-08-08 00:00:00,Y,United Kingdom,GBR,pycountry,2025,8,8,Yes
45,46,ARB/25/36,Tara Resources AG,Y,Montenegro,Pending,Y,2025-08-05 00:00:00,Y,Montenegro,MNE,pycountry,2025,8,5,Yes
46,47,ARB/25/35,"Asesores Financieros Andalucía Occidental, Sociedad Gestora de Patrimonios S.A.",Y,Oriental Republic of Uruguay,Pending,Y,2025-07-29 00:00:00,Y,Uruguay,URY,embedded_pycountry,2025,7,29,No
47,48,ARB/25/34,ArcelorMittal S.A.,Y,Italian Republic,Pending,Y,2025-07-25 00:00:00,Y,Italy,ITA,pycountry,2025,7,25,No
48,49,ARB/25/33,Gestion Bayonne Inc. and 9048-4957 Québec Inc.,Y,Republic of Costa Rica,Pending,Y,2025-07-14 00:00:00,Y,Costa Rica,CRI,pycountry,2025,7,14,No
49,50,ARB/25/32,Allianz SE,Y,United Mexican States,Concluded,Y,2025-07-03 00:00:00,Y,Mexico,MEX,pycountry,2025,7,3,No
50,51,ARB/25/31,"Mota-Engil Engenharía e Construção, S.A.",Y,Republic of Paraguay,Pending,Y,2025-07-01 00:00:00,Y,Paraguay,PRY,pycountry,2025,7,1,No
51,52,ARB/25/30,Estate of Ian Colin Orr-Ewing and others,Y,United Mexican States,Pending,Y,2025-06-27 00:00:00,Y,Mexico,MEX,pycountry,2025,6,27,Yes
52,54,ARB/25/29,"FCC Construcción, S.A.",Y,Republic of Panama,Pending,Y,2025-06-20 00:00:00,Y,Panama,PAN,pycountry,2025,6,20,No
53,55,ARB/25/28,AEROC Investment Deutschland GmbH,Y,Ukraine,Pending,Y,2025-06-18 00:00:00,Y,Ukraine,UKR,pycountry,2025,6,18,No
54,56,ARB(AF)/25/5,Libyan Arab Foreign Investment Company,Y,Kingdom of Belgium ,Concluded,Y,2025-06-18 00:00:00,Y,Belgium,BEL,pycountry,2025,6,18,No
55,57,ARB/25/27,Eka Tjandranegara,Y,Malaysia,Pending,Y,2025-06-10 00:00:00,Y,Malaysia,MYS,pycountry,2025,6,10,No
56,58,ARB/25/26,Samvel Karapetyan,Y,French Republic ,Pending,Y,2025-06-04 00:00:00,Y,France,FRA,pycountry,2025,6,4,No
57,59,ARB/25/25,Park Avenue Capital LLC,Y,Republic of Moldova ,Pending,Y,2025-05-30 00:00:00,Y,"Moldova, Republic of",MDA,pycountry,2025,5,30,No
58,60,ARB/25/24,Humans Mobile Ltd.,Y,Republic of Uzbekistan,Pending,Y,2025-05-30 00:00:00,Y,Uzbekistan,UZB,pycountry,2025,5,30,No
59,61,ARB/25/23,Woodside Energy (Sénégal) B.V.,Y,Republic of Senegal,Pending,Y,2025-05-30 00:00:00,Y,Senegal,SEN,pycountry,2025,5,30,Yes
60,62,ARB/25/22,Khemisset UK Limited and Potasse de Khemisset S.A.,Y,Kingdom of Morocco,Pending,Y,2025-05-23 00:00:00,Y,Morocco,MAR,pycountry,2025,5,23,Yes
61,63,ARB/25/21,ETA Star International LLC,Y,Republic of Angola,Pending,Y,2025-05-19 00:00:00,Y,Angola,AGO,pycountry,2025,5,19,No
62,64,ARB(AF)/25/4,Overseas Real Estate LLC,Y,Republic of Honduras ,Pending,Y,2025-05-15 00:00:00,Y,Honduras,HND,pycountry,2025,5,15,No
63,65,ARB/25/20,Korea Mine Rehabilitation & Mineral Resources Corporation,Y,Republic of Panama,Pending,Y,2025-05-09 00:00:00,Y,Panama,PAN,pycountry,2025,5,9,Yes
64,66,ARB/25/19,Oleoducto de Crudos Pesados (OCP) Ltd.,Y,Republic of Ecuador,Concluded,Y,2025-05-02 00:00:00,Y,Ecuador,ECU,pycountry,2025,5,2,Yes
65,67,ARB(AF)/25/3,José Alejandro Hernández Contreras,Y,Republic of Costa Rica,Pending,Y,2025-05-01 00:00:00,Y,Costa Rica,CRI,pycountry,2025,5,1,No
66,68,ARB(AF)/25/2,GR Mining (Barbados) Inc.,Y,Bolivarian Republic of Venezuela,Pending,Y,2025-04-28 00:00:00,Y,"Venezuela, Bolivarian Republic of",VEN,pycountry,2025,4,28,Yes
67,69,ARB(AF)/25/1,Bright Mountain Pty. Ltd.,Y,Republic of the Union of Myanmar,Pending,Y,2025-04-21 00:00:00,Y,Myanmar,MMR,embedded_pycountry,2025,4,21,Yes
68,70,ARB/25/18,"First Quantum Minerals, Ltd.",Y,Republic of Panama,Pending,Y,2025-04-11 00:00:00,Y,Panama,PAN,pycountry,2025,4,11,Yes
69,71,ARB/25/17,"L’Air Liquide, société anonyme pour l’Etude et l’Exploitation des procédés Georges Claude, Air Liquide International S.A., and Azerus S.A.S.",Y,United Mexican States,Pending,Y,2025-04-07 00:00:00,Y,Mexico,MEX,pycountry,2025,4,7,Yes
70,72,ARB/25/16,"Amec Foster Wheeler USA Corporation, Process Consultants, Inc., and Joint Venture Foster Wheeler USA Corporation and Process Consultants, Inc.",Y,Republic of Colombia,Pending,Y,2025-04-07 00:00:00,Y,Colombia,COL,pycountry,2025,4,7,Yes
71,73,ARB/25/15,United Operations Limited,Y,Union of the Comoros,Concluded,Y,2025-03-31 00:00:00,Y,Comoros,COM,pycountry,2025,3,31,No
72,74,ARB/25/14,Brookfield Corporation,Y,Republic of Peru,Pending,Y,2025-03-27 00:00:00,Y,Peru,PER,pycountry,2025,3,27,No
73,75,ARB/25/13,"Victoria Oil & Gas Plc (in Administration), Victoria Energy Central Asia UK Limited and Victoria Energy Central Asia LLP",Y,Republic of Kazakhstan,Pending,Y,2025-03-21 00:00:00,Y,Kazakhstan,KAZ,pycountry,2025,3,21,Yes
75,77,ARB/25/11,Dirk Andres in his capacity as insolvency administrator regarding the assets of HBH,Y,People's Democratic Republic of Algeria,Pending,Y,2025-03-14 00:00:00,Y,Algeria,DZA,pycountry,2025,3,14,No
76,78,ARB/25/10,E.M.I.S. Finance B.V.,Y,Ukraine,Pending,Y,2025-03-10 00:00:00,Y,Ukraine,UKR,pycountry,2025,3,10,No
77,79,ARB/25/9,Orano Mining SAS,Y,Republic of Niger,Pending,Y,2025-03-05 00:00:00,Y,Niger,NER,embedded_pycountry,2025,3,5,Yes
78,80,ARB/25/8,Orano Mining SAS,Y,Republic of Niger,Pending,Y,2025-03-05 00:00:00,Y,Niger,NER,embedded_pycountry,2025,3,5,Yes
79,81,ARB/25/7,Draslovka Holding A.S.,Y,United Mexican States,Pending,Y,2025-02-18 00:00:00,Y,Mexico,MEX,pycountry,2025,2,18,No
80,82,CONC/25/1,Republic of Togo,Y,ContourGlobal Togo SA,Concluded,Y,2025-02-06 00:00:00,Y,Togo,TGO,embedded_pycountry,2025,2,6,No
81,83,ARB/25/6,"Fibranet, Sociedad Anónima",Y,Republic of El Salvador,Concluded,Y,2025-01-23 00:00:00,Y,El Salvador,SLV,pycountry,2025,1,23,No
82,84,ARB/25/5,"Centauro Capital, S.L.U. and Natanor XXI, S.L.U.",Y,Republic of Colombia,Pending,Y,2025-01-21 00:00:00,Y,Colombia,COL,pycountry,2025,1,21,No
83,85,ARB/25/4,Maritime Archaeology Consultants Switzerland AG,Y,Republic of Colombia,Pending,Y,2025-01-13 00:00:00,Y,Colombia,COL,pycountry,2025,1,13,No
84,86,ARB/25/3,Ngondo Mining SARL,Y,Democratic Republic of the Congo,Pending,Y,2025-01-13 00:00:00,Y,Congo,COG,embedded_pycountry,2025,1,13,Yes
85,87,ARB/25/2,Société des Mines de Loulo S.A. and Société des Mines de Gounkoto S.A.,Y,Republic of Mali,Concluded,Y,2025-01-10 00:00:00,Y,Mali,MLI,pycountry,2025,1,10,Yes
86,88,ARB/25/1,GoviEx Niger Holdings Ltd. and GoviEx Uranium Inc.,Y,Republic of Niger,Pending,Y,2025-01-02 00:00:00,Y,Niger,NER,embedded_pycountry,2025,1,2,Yes
87,89,ARB/24/52,Minerali Industriali SRL,Y,Republic of Tunisia,Pending,Y,2024-12-23 00:00:00,Y,Tunisia,TUN,pycountry,2024,12,23,Yes
88,90,ARB/24/53,"Unión de Cervecerías Peruanas Backus y Johnston S.A.A., Cervecería San Juan S.A. and AB InBev Southern Investment Ltd.",Y,Republic of Peru,Pending,Y,2024-12-23 00:00:00,Y,Peru,PER,pycountry,2024,12,23,No
89,91,ARB/24/51,Sarama Resources Ltd,Y,Burkina Faso,Pending,Y,2024-12-23 00:00:00,Y,Burkina Faso,BFA,pycountry,2024,12,23,Yes
90,92,ARB/24/50,Riversdale Resources Pty Ltd and Hancock Prospecting Pty Ltd,Y,Canada,Pending,Y,2024-12-23 00:00:00,Y,Canada,CAN,pycountry,2024,12,23,Yes
91,93,ARB/24/49,AXA S.A.,Y,United Mexican States,Concluded,Y,2024-12-05 00:00:00,Y,Mexico,MEX,pycountry,2024,12,5,No
92,94,ARB/24/48,Alain Francois V. Goetz and Aldabra Limited,Y,Republic of Rwanda,Pending,Y,2024-11-01 00:00:00,Y,Rwanda,RWA,embedded_pycountry,2024,11,1,Yes
93,95,ARB/24/47,Société Industrielle de Viande de Côte d’Ivoire,Y,Republic of Côte d’Ivoire,Pending,Y,2024-11-01 00:00:00,Y,Côte d'Ivoire,CIV,alias,2024,11,1,No
94,96,ARB/24/46,ENCORE Investment Group Limited,Y,Republic of Türkiye,Pending,Y,2024-10-25 00:00:00,Y,Türkiye,TUR,pycountry,2024,10,25,No
95,97,ARB/24/45,Nurhima Kiram Fornan and others,Y,Kingdom of Spain,Concluded,Y,2024-10-24 00:00:00,Y,Spain,ESP,pycountry,2024,10,24,No
96,98,ARB/24/44,ExxonMobil Petroleum & Chemical BV,Y,Kingdom of the Netherlands,Pending,Y,2024-10-21 00:00:00,Y,Netherlands,NLD,pycountry,2024,10,21,Yes
97,99,ARB/24/43,"Concesionaria Angostura Siguas, S.A.",Y,Republic of Peru,Pending,Y,2024-10-16 00:00:00,Y,Peru,PER,pycountry,2024,10,16,No
98,100,ARB/24/42,Aqua Power and Catalysis Capital Ltd,Y,United Republic of Tanzania,Pending,Y,2024-10-09 00:00:00,Y,"Tanzania, United Republic of",TZA,pycountry,2024,10,9,No
99,101,ARB/24/41,TMA Australia Pty Ltd and others,Y,Republic of the Philippines,Pending,Y,2024-09-23 00:00:00,Y,Philippines,PHL,pycountry,2024,9,23,No
100,102,ARB/24/40,Minas de Revuboè Limitada,Y,Republic of Mozambique,Concluded,Y,2024-09-09 00:00:00,Y,Mozambique,MOZ,pycountry,2024,9,9,Yes
102,104,ARB/24/38,Sauna UK BidCo Limited,Y,Republic of Finland,Pending,Y,2024-08-23 00:00:00,Y,Finland,FIN,pycountry,2024,8,23,No
103,105,ARB/24/37,"Suomi Power Networks TopCo B.V., Supernova II Bidco BV and AMF Tjänstepension AB",Y,Republic of Finland ,Pending,Y,2024-08-23 00:00:00,Y,Finland,FIN,pycountry,2024,8,23,No
104,106,ARB/24/36,PETRONAS International Corporation Ltd,Y,Republic of South Sudan,Pending,Y,2024-08-23 00:00:00,Y,South Sudan,SSD,pycountry,2024,8,23,Yes
105,107,ARB/24/35,CTF Holdings S.A.,Y,Ukraine,Pending,Y,2024-08-16 00:00:00,Y,Ukraine,UKR,pycountry,2024,8,16,No
106,108,ARB/24/34,International Container Terminal Services Inc.,Y,Republic of Honduras,Pending,Y,2024-08-16 00:00:00,Y,Honduras,HND,pycountry,2024,8,16,No
107,109,ARB/24/33,"Operadora Portuaria Centroamericana, S.A. de C.V.",Y,Republic of Honduras,Pending,Y,2024-08-16 00:00:00,Y,Honduras,HND,pycountry,2024,8,16,No
108,110,ARB/24/32,Víctor Miguel Silhy Zacarías,Y,Republic of Honduras,Pending,Y,2024-08-08 00:00:00,Y,Honduras,HND,pycountry,2024,8,8,No
109,111,ARB/24/31,X-Elio Energy S.L.,Y,Republic of Honduras,Pending,Y,2024-08-08 00:00:00,Y,Honduras,HND,pycountry,2024,8,8,No
110,112,ARB/24/30,NC Telecom AS and others,Y,Republic of Chile,Concluded,Y,2024-08-02 00:00:00,Y,Chile,CHL,pycountry,2024,8,2,No
111,113,ARB/24/29,Gasoducto Sur Peruano S.A. En Liquidación,Y,Republic of Peru,Pending,Y,2024-07-30 00:00:00,Y,Peru,PER,pycountry,2024,7,30,Yes
112,114,ARB/24/28,Qatar National Bank (Q.P.S.C),Y,Republic of the Sudan and Central Bank of Sudan,Pending,Y,2024-07-24 00:00:00,Y,Sudan,SDN,embedded_pycountry,2024,7,24,No
113,115,ARB/24/27,Orla Mining Ltd.,Y,Republic of Panama ,Pending,Y,2024-07-19 00:00:00,Y,Panama,PAN,pycountry,2024,7,19,Yes
114,116,ARB(AF)/24/2,"Warburg Pincus (Cayman) XII GP LLC, Gemini Polska sp. z o.o. and Polish Pharmacies sp. z o.o.",Y,Republic of Poland,Pending,Y,2024-07-18 00:00:00,Y,Poland,POL,pycountry,2024,7,18,No
115,117,ARB/24/26,Franco-Nevada Corporation,Y,Republic of Panama,Pending,Y,2024-07-12 00:00:00,Y,Panama,PAN,pycountry,2024,7,12,Yes
116,118,ARB/24/25,Continental Gold Inc.,Y,Republic of Colombia,Pending,Y,2024-07-12 00:00:00,Y,Colombia,COL,pycountry,2024,7,12,Yes
117,119,ARB/24/24,Eléctricas de Medellín Ingeniería y Servicios S.A.S.,Y,Republic of Honduras,Pending,Y,2024-07-02 00:00:00,Y,Honduras,HND,pycountry,2024,7,2,No
118,120,ARB/24/22,Berkeley Exploration Ltd.,Y,Kingdom of Spain,Pending,Y,2024-06-27 00:00:00,Y,Spain,ESP,pycountry,2024,6,27,Yes
119,121,ARB/24/23,Almaden Minerals Ltd. and Almadex Minerals Ltd.,Y,United Mexican States,Pending,Y,2024-06-27 00:00:00,Y,Mexico,MEX,pycountry,2024,6,27,Yes
120,122,ARB/24/21,"Bacanora Lithium Limited, Sonora Lithium Ltd., and Ganfeng International Trading (Shanghai) Co. Ltd.",Y,United Mexican States,Pending,Y,2024-06-21 00:00:00,Y,Mexico,MEX,pycountry,2024,6,21,Yes
121,124,ARB/24/20,Walnort Finance Limited,Y,Republic of Armenia,Pending,Y,2024-06-21 00:00:00,Y,Armenia,ARM,pycountry,2024,6,21,Yes
122,125,ARB/24/19,MOL Hungarian Oil and Gas Public Limited Company,Y,Republic of Croatia,Pending,Y,2024-06-20 00:00:00,Y,Croatia,HRV,pycountry,2024,6,20,Yes
123,126,ARB/24/18,Eurohold Bulgaria AD and Euroins Insurance Group AD,Y,Romania,Pending,Y,2024-06-07 00:00:00,Y,Romania,ROU,pycountry,2024,6,7,No
124,127,ARB/24/17,NiQuan Energy LLC and NiQuan Energy Trinidad Limited,Y,Republic of Trinidad and Tobago,Pending,Y,2024-05-31 00:00:00,Y,Trinidad and Tobago,TTO,pycountry,2024,5,31,Yes
125,128,ARB/24/16,Spentech Engineering Limited,Y,United Arab Emirates,Pending,Y,2024-05-24 00:00:00,Y,United Arab Emirates,ARE,pycountry,2024,5,24,No
126,130,ARB/24/15,Djamel Ben Ferha,Y,Kingdom of Belgium,Pending,Y,2024-05-24 00:00:00,Y,Belgium,BEL,pycountry,2024,5,24,No
127,131,ARB/24/14,Neltume Ports S.A.,Y,Oriental Republic of Uruguay,Pending,Y,2024-05-23 00:00:00,Y,Uruguay,URY,embedded_pycountry,2024,5,23,No
128,132,ARB/24/13,Lotus Proje Akaryakıt Enerji Madencilik Telekominikasyon İnşaat Sanayi Taah. Ve Tic. A.Ş.,Y,Turkmenistan,Concluded,Y,2024-05-20 00:00:00,Y,Turkmenistan,TKM,pycountry,2024,5,20,No
129,133,ARB/24/12,Petaquilla Minerals Ltd.,Y,Republic of Panama,Pending,Y,2024-05-16 00:00:00,Y,Panama,PAN,pycountry,2024,5,16,Yes
130,134,ARB/24/11,ATCO Ltd.,Y,Oriental Republic of Uruguay,Pending,Y,2024-05-09 00:00:00,Y,Uruguay,URY,embedded_pycountry,2024,5,9,No
131,135,ARB/24/10,"Kent Kart Anadolu Elektronik Sanayi ve Ticaret Anonim Şirketi, Kent Kart Ege Elektronik Sanayi ve Ticaret Anonim Şirketi and Kentkart Global Elektronik Anonim Şirketi",Y,Republic of Serbia,Pending,Y,2024-04-01 00:00:00,Y,Serbia,SRB,pycountry,2024,4,1,No
132,136,ARB/24/9,Gas Natural de Lima y Callao S.A.,Y,Republic of Peru,Pending,Y,2024-04-01 00:00:00,Y,Peru,PER,pycountry,2024,4,1,Yes
133,137,ARB/24/8,Ricardo Filomeno Duarte Ventura Leitão Machado,Y,Republic of Angola,Pending,Y,2024-03-28 00:00:00,Y,Angola,AGO,pycountry,2024,3,28,No
134,138,ARB/24/7,Kiabod Tutunian Mashad,Y,Republic of Belarus,Pending,Y,2024-03-19 00:00:00,Y,Belarus,BLR,pycountry,2024,3,19,No
135,139,ARB/24/6,Stratius Investments Limited,Y,Hungary,Pending,Y,2024-03-13 00:00:00,Y,Hungary,HUN,pycountry,2024,3,13,No
136,140,ARB/24/5,"Fotowatio Renewable Ventures S.L.U., FRV Solar Holdings III, S.L.U. and FRV Solar Holdings VI, S.L.U.",Y,United Mexican States,Pending,Y,2024-03-13 00:00:00,Y,Mexico,MEX,pycountry,2024,3,13,No
137,141,ARB/24/4,Rome Resources PLC and IM Minerals Limited,Y,Republic of Mozambique,Concluded,Y,2024-02-14 00:00:00,Y,Mozambique,MOZ,pycountry,2024,2,14,Yes
138,142,ARB(AF)/24/1,Mondi Investments Limited,Y,Republic of Poland,Pending,Y,2024-01-31 00:00:00,Y,Poland,POL,pycountry,2024,1,31,No
139,143,ARB/24/3,"InfraRed Infrastructure RAM GP Limited, InfraRed Infrastructure RAM LP and InfraRed Infrastructure RAM, S.L.",Y,Republic of Colombia,Pending,Y,2024-01-25 00:00:00,Y,Colombia,COL,pycountry,2024,1,25,No
140,144,ARB/24/2,"Nexo AG, NDS EOOD and Mirastar EOOD",Y,Republic of Bulgaria,Pending,Y,2024-01-18 00:00:00,Y,Bulgaria,BGR,pycountry,2024,1,18,No
141,145,ARB/24/1,ABH Holdings S.A.,Y,Ukraine,Pending,Y,2024-01-11 00:00:00,Y,Ukraine,UKR,pycountry,2024,1,11,No
142,146,UNCT/23/4,Alberta Petroleum Marketing Commission,Y,United States of America,Pending,Y,2023-11-30 00:00:00,Y,United States,USA,pycountry,2023,11,30,Yes
143,147,ARB/23/53,Caisse de dépôt et placement du Québec and CDP Groupe Infrastructures Inc.,Y,United Mexican States,Pending,Y,2023-12-15 00:00:00,Y,Mexico,MEX,pycountry,2023,12,15,No
144,148,UNCT/23/3,Abdallah Andraous,Y,Kingdom of the Netherlands,Concluded,Y,2023-10-18 00:00:00,Y,Netherlands,NLD,pycountry,2023,10,18,No
145,149,ARB/23/52,IJM Corporation Berhad,Y,Argentine Republic,Pending,Y,2023-12-11 00:00:00,Y,Argentina,ARG,pycountry,2023,12,11,No
146,150,ARB(AF)/23/3,Libyan Investment Authority and Libyan Arab Foreign Investment Company,Y,Kingdom of Belgium,Pending,Y,2023-12-11 00:00:00,Y,Belgium,BEL,pycountry,2023,12,11,No
147,151,ARB/23/51,NGE Contracting and Leduc,Y,Republic of Senegal,Concluded,Y,2023-11-20 00:00:00,Y,Senegal,SEN,pycountry,2023,11,20,No
148,152,ARB(AF)/23/2,Kellogg Latin America Holding Company (One) Limited,Y,Bolivarian Republic of Venezuela,Pending,Y,2023-11-09 00:00:00,Y,"Venezuela, Bolivarian Republic of",VEN,pycountry,2023,11,9,No
149,153,ARB/23/50,Glencore International A.G. & others,Y,Republic of Colombia,Pending,Y,2023-11-16 00:00:00,Y,Colombia,COL,pycountry,2023,11,16,Yes
150,154,UNCT/22/1,"Coeur Mining, Inc.",Y,United Mexican States,Pending,Y,2022-11-07 00:00:00,Y,Mexico,MEX,pycountry,2022,11,7,Yes
151,155,ARB(AF)/23/1,Klesch Group Holdings Limited & others,Y,European Union,Pending,Y,2023-10-24 00:00:00,Y,European Union,,alias,2023,10,24,Yes
152,156,ARB/23/49,Klesch Group Holdings Limited and Raffinerie Heide GmbH,Y,Federal Republic of Germany,Pending,Y,2023-10-24 00:00:00,Y,Germany,DEU,pycountry,2023,10,24,Yes
153,157,ARB/23/48,"Klesch Group Holdings Limited, Klesch Refining Denmark A/S and Kalundborg Refinery A/S",Y,Kingdom of Denmark,Pending,Y,2023-10-24 00:00:00,Y,Denmark,DNK,pycountry,2023,10,24,Yes
154,158,ARB/23/47,Azienda Elettrica Ticinese,Y,Federal Republic of Germany,Pending,Y,2023-10-20 00:00:00,Y,Germany,DEU,pycountry,2023,10,20,No
155,159,ARB/23/46,Libra LLC and others,Y,Republic of Azerbaijan,Pending,Y,2023-10-16 00:00:00,Y,Azerbaijan,AZE,pycountry,2023,10,16,No
156,160,ARB/23/45,Mirian G. Dekanoidze and T.G. Trade LLC,Y,Georgia,Pending,Y,2023-10-03 00:00:00,Y,Georgia,GEO,pycountry,2023,10,3,No
157,161,ARB/23/44,Elsewedy Electric for Transmission and Distribution of Energy S.A.E.,Y,Republic of South Sudan,Pending,Y,2023-09-28 00:00:00,Y,South Sudan,SSD,pycountry,2023,9,28,No
158,162,ARB/23/43,Fernando Paiz Andrade and Anabella Schloesser de León de Paiz,Y,Republic of Honduras,Pending,Y,2023-09-13 00:00:00,Y,Honduras,HND,pycountry,2023,9,13,No
159,163,ARB/23/42,"Palmerola International Airport, S.A. de C.V.",Y,Republic of Honduras,Concluded,Y,2023-09-12 00:00:00,Y,Honduras,HND,pycountry,2023,9,12,No
160,164,CONC/23/1,"APM Terminals Management Barcelona, S.L.U.",Y,Republic of Guatemala,Concluded,Y,2023-09-08 00:00:00,Y,Guatemala,GTM,pycountry,2023,9,8,No
161,165,ARB/23/41,"Banesco Holding Latinoamérica, S.A. and Banesco (Panamá), S.A.",Y,Republic of Panama,Concluded,Y,2023-09-08 00:00:00,Y,Panama,PAN,pycountry,2023,9,8,No
162,166,ARB/23/40,"Inversiones y Desarrollos Energéticos, S.A.",Y,Republic of Honduras,Pending,Y,2023-08-30 00:00:00,Y,Honduras,HND,pycountry,2023,8,30,No
163,167,ARB/23/39,"Abertis Infraestructuras, S.A.",Y,Argentine Republic,Pending,Y,2023-08-29 00:00:00,Y,Argentina,ARG,pycountry,2023,8,29,No
164,168,ARB/23/38,Afriland First Group SA and others,Y,Democratic Republic of the Congo,Pending,Y,2023-08-28 00:00:00,Y,Congo,COG,embedded_pycountry,2023,8,28,No
165,169,ARB/23/37,TV Azteca S.A.B de C.V. and Azteca Comunicaciones Perú S.A.C.,Y,Republic of Peru,Pending,Y,2023-08-23 00:00:00,Y,Peru,PER,pycountry,2023,8,23,No
166,170,ARB/23/36,Güriş İnşaat ve Mühendislik Anonim Şirketi,Y,Kingdom of Saudi Arabia,Pending,Y,2023-08-21 00:00:00,Y,Saudi Arabia,SAU,pycountry,2023,8,21,No
167,171,ARB/23/35,Amadeus Group and Amadeus Development DOOEL,Y,Republic of North Macedonia,Pending,Y,2023-08-18 00:00:00,Y,North Macedonia,MKD,pycountry,2023,8,18,No
168,172,ARB/23/34,Groupe Pizzorno Environnement,Y,Kingdom of Morocco,Concluded,Y,2023-08-11 00:00:00,Y,Morocco,MAR,pycountry,2023,8,11,No
169,173,ARB/23/33,"Cyrus Capital Partners, L.P. and Contrarian Capital Management, LLC",Y,United Mexican States,Pending,Y,2023-08-11 00:00:00,Y,Mexico,MEX,pycountry,2023,8,11,No
170,174,ARB/23/32,BA Desarrollos LLC,Y,Argentine Republic,Pending,Y,2023-08-04 00:00:00,Y,Argentina,ARG,pycountry,2023,8,4,No
171,175,ARB/23/31,FCL Ambiente S.r.l.,Y,Republic of North Macedonia,Pending,Y,2023-07-31 00:00:00,Y,North Macedonia,MKD,pycountry,2023,7,31,No
172,176,ARB/23/30,"United Agencies Limited SA, Mediterranean Shipping Company Algérie SARL and Maghrebine des Transports & Auxiliaires SARL",Y,People’s Democratic Republic of Algeria,Pending,Y,2023-07-26 00:00:00,Y,Algeria,DZA,embedded_pycountry,2023,7,26,No
173,177,ARB/23/29,Mario Noriega Willars,Y,United Mexican States,Pending,Y,2023-07-21 00:00:00,Y,Mexico,MEX,pycountry,2023,7,21,No
174,178,ARB/23/28,First Majestic Silver Corp.,Y,United Mexican States,Concluded,Y,2023-07-21 00:00:00,Y,Mexico,MEX,pycountry,2023,7,21,Yes
