,caseid,caseno,claimant,isapproved,respondent,status,isapproved,dateregistered,isapproved,country_clean,country_iso3,extraction_method,registration_year,registration_month,registration_day,miningcase
688,872,ARB/13/33,PNG Sustainable Development Program Ltd.,Y,Independent State of Papua New Guinea ,Concluded,Y,2013-12-20 00:00:00,Y,Papua New Guinea,PNG,pycountry,2013,12,20,Yes
689,873,ARB/13/32,MOL Hungarian Oil and Gas Company Plc,Y,Republic of Croatia,Concluded,Y,2013-12-05 00:00:00,Y,Croatia,HRV,pycountry,2013,12,5,Yes
690,874,ARB/13/31,Infrastructure Services Luxembourg S.à.r.l. and Energia Termosolar B.V. (formerly Antin Infrastructure Services Luxembourg S.à.r.l. and Antin Energia Termosolar B.V.),Y,Kingdom of Spain,Concluded,Y,2013-11-22 00:00:00,Y,Spain,ESP,pycountry,2013,11,22,No
691,877,ARB/13/30,RREEF Infrastructure (G.P.) Limited and RREEF Pan-European Infrastructure Two Lux S.à r.l.,Y,Kingdom of Spain,Concluded,Y,2013-11-22 00:00:00,Y,Spain,ESP,pycountry,2013,11,22,No
692,879,ARB/13/29,Cementos La Union S.A. and Aridos Jativa S.L.U,Y,Arab Republic of Egypt,Concluded,Y,2013-11-22 00:00:00,Y,Egypt,EGY,pycountry,2013,11,22,No
693,881,ARB(AF)/13/2,"Cemusa - Corporación Europea de Mobiliario Urbano, S.A. and Corporación Americana de Equipamientos Urbanos, S.L.",Y,United Mexican States,Concluded,Y,2013-11-06 00:00:00,Y,Mexico,MEX,pycountry,2013,11,6,No
694,882,UNCT/13/2,"Aaron C.Berkowitz, Brett E. Berkowitz and Trevor B. Berkowitz",Y,Republic of Costa Rica,Concluded,Y,2013-10-17 00:00:00,Y,Costa Rica,CRI,pycountry,2013,10,17,No
695,883,ARB/13/28,"Transglobal Green Energy, LLC and Transglobal Green Energy de Panama, S.A.",Y,Republic of Panama ,Concluded,Y,2013-10-10 00:00:00,Y,Panama,PAN,pycountry,2013,10,10,No
696,884,ARB/13/27,"Marfin Investment Group Holdings S.A., Alexandros Bakatselos and others ",Y,Republic of Cyprus,Concluded,Y,2013-09-27 00:00:00,Y,Cyprus,CYP,pycountry,2013,9,27,No
697,885,ARB/13/26,"Spentex Netherlands, B.V.",Y,Republic of Uzbekistan,Concluded,Y,2013-09-27 00:00:00,Y,Uzbekistan,UZB,pycountry,2013,9,27,No
698,886,ARB/13/25,Tullow Uganda Operations Pty Ltd and Tullow Uganda Limited,Y,Republic of Uganda,Concluded,Y,2013-09-26 00:00:00,Y,Uganda,UGA,pycountry,2013,9,26,Yes
700,888,ARB/13/23,ASA International S.p.A.,Y,Arab Republic of Egypt,Concluded,Y,2013-09-13 00:00:00,Y,Egypt,EGY,pycountry,2013,9,13,No
701,889,ARB/13/22,Erbil Serter,Y,French Republic,Concluded,Y,2013-09-10 00:00:00,Y,France,FRA,pycountry,2013,9,10,No
702,890,ARB/13/21,Edenred S.A.,Y,Hungary,Concluded,Y,2013-09-09 00:00:00,Y,Hungary,HUN,pycountry,2013,9,9,No
703,893,ARB/13/20,Interocean Oil Development Company and Interocean Oil Exploration Company,Y,Federal Republic of Nigeria,Concluded,Y,2013-09-09 00:00:00,Y,Nigeria,NGA,pycountry,2013,9,9,Yes
704,894,ARB/13/19,Güneş Tekstil Konfeksiyon Sanayi ve Ticaret Limited Şirketi and others,Y,Republic of Uzbekistan,Concluded,Y,2013-08-29 00:00:00,Y,Uzbekistan,UZB,pycountry,2013,8,29,No
705,896,UNCT/13/1,"The Renco Group, Inc.",Y,Republic of Peru,Concluded,Y,2011-04-04 00:00:00,Y,Peru,PER,pycountry,2011,4,4,Yes
706,897,ARB/13/18,Enel Green Power S.p.A.,Y,Republic of El Salvador,Concluded,Y,2013-08-21 00:00:00,Y,El Salvador,SLV,pycountry,2013,8,21,No
707,898,ARB/13/17,EVN AG,Y,Republic of Bulgaria ,Concluded,Y,2013-07-19 00:00:00,Y,Bulgaria,BGR,pycountry,2013,7,19,No
708,899,ARB/13/16,Société des Mines de Loulo S.A.,Y,Republic of Mali,Concluded,Y,2013-07-18 00:00:00,Y,Mali,MLI,pycountry,2013,7,18,Yes
709,900,ARB/13/15,Lundin Tunisia B.V.,Y,Republic of Tunisia ,Concluded,Y,2013-07-18 00:00:00,Y,Tunisia,TUN,pycountry,2013,7,18,Yes
710,901,ARB/13/14,RSM Production Corporation,Y,Republic of Cameroon,Concluded,Y,2013-07-01 00:00:00,Y,Cameroon,CMR,pycountry,2013,7,1,Yes
711,902,ARB/13/13,Caratube International Oil Company LLP and Devincci Salah Hourani,Y,Republic of Kazakhstan,Concluded,Y,2013-06-28 00:00:00,Y,Kazakhstan,KAZ,pycountry,2013,6,28,Yes
712,904,ARB/13/12,"Lieven J. van Riet, Chantal C. van Riet and Christopher van Riet",Y,Republic of Croatia ,Concluded,Y,2013-06-21 00:00:00,Y,Croatia,HRV,pycountry,2013,6,21,No
713,905,ARB/13/11,"Valores Mundiales, S.L. and Consorcio Andino, S.L.",Y,Bolivarian Republic of Venezuela,Concluded,Y,2013-06-06 00:00:00,Y,"Venezuela, Bolivarian Republic of",VEN,pycountry,2013,6,6,No
714,907,ARB/13/10,"Impresa Grassetto S. p. A., in liquidation",Y,Republic of Slovenia ,Concluded,Y,2013-06-04 00:00:00,Y,Slovenia,SVN,pycountry,2013,6,4,No
715,908,ARB/13/9,Federal Elektrik Yatırım ve Ticaret A.Ş. and others,Y,Republic of Uzbekistan,Concluded,Y,2013-05-24 00:00:00,Y,Uzbekistan,UZB,pycountry,2013,5,24,Yes
716,909,ARB/13/7,Joseph Houben,Y,Republic of Burundi,Concluded,Y,2013-05-20 00:00:00,Y,Burundi,BDI,pycountry,2013,5,20,No
717,910,ARB/13/8,"Poštová banka, a.s. and ISTROKAPITAL SE",Y,Hellenic Republic,Concluded,Y,2013-05-20 00:00:00,Y,Greece,GRC,pycountry,2013,5,20,No
718,912,ARB/13/6,Vladislav Kim and others,Y,Republic of Uzbekistan,Concluded,Y,2013-04-24 00:00:00,Y,Uzbekistan,UZB,pycountry,2013,4,24,No
719,913,ARB(AF)/13/1,Consolidated Exploration Holdings Ltd. and others,Y,Kyrgyz Republic,Concluded,Y,2013-04-23 00:00:00,Y,Kyrgyzstan,KGZ,alias,2013,4,23,Yes
720,914,ARB/13/5,Ossama Al Sharif ,Y,Arab Republic of Egypt,Concluded,Y,2013-03-13 00:00:00,Y,Egypt,EGY,pycountry,2013,3,13,No
721,915,ARB/13/4,Ossama Al Sharif,Y,Arab Republic of Egypt ,Concluded,Y,2013-03-13 00:00:01,Y,Egypt,EGY,pycountry,2013,3,13,No
722,916,ARB/13/3,Ossama Al Sharif ,Y,Arab Republic of Egypt ,Concluded,Y,2013-03-13 00:00:00,Y,Egypt,EGY,pycountry,2013,3,13,No
723,917,ARB/13/2,Cervin Investissements S.A. and Rhone Investissements S.A.,Y,Republic of Costa Rica,Concluded,Y,2013-03-11 00:00:00,Y,Costa Rica,CRI,pycountry,2013,3,11,Yes
724,918,ARB/13/1,Karkey Karadeniz Elektrik Uretim A.S.,Y,Islamic Republic of Pakistan,Concluded,Y,2013-02-08 00:00:00,Y,Pakistan,PAK,pycountry,2013,2,8,No
725,921,ARB/12/40 and 12/14,"Churchill Mining Plc and Planet Mining Pty Ltd, formerly ARB/12/40",Y,Republic of Indonesia,Concluded,Y,2012-12-26 00:00:00,Y,Indonesia,IDN,pycountry,2012,12,26,Yes
726,923,ARB/12/38,"Repsol, S.A. and Repsol Butano, S.A.",Y,Argentine Republic,Concluded,Y,2012-12-18 00:00:00,Y,Argentina,ARG,pycountry,2012,12,18,Yes
727,924,ARB/12/37,LSF-KEB Holdings SCA and others,Y,Republic of Korea,Concluded,Y,2012-12-10 00:00:00,Y,South Korea,,alias,2012,12,10,No
728,928,ARB(AF)/12/8,MNSS B.V. and Recupero Credito Acciaio N.V.,Y,Montenegro,Concluded,Y,2012-12-06 00:00:00,Y,Montenegro,MNE,pycountry,2012,12,6,No
729,930,ARB/12/36,Société Civile Immobilière de Gaëta,Y,Republic of Guinea,Concluded,Y,2012-11-28 00:00:00,Y,Guinea,GIN,pycountry,2012,11,28,No
730,931,ARB/12/35,Orascom TMT Investments S.à r.l.,Y,People's Democratic Republic of Algeria,Concluded,Y,2012-11-15 00:00:00,Y,Algeria,DZA,pycountry,2012,11,15,No
731,933,ARB(AF)/12/7,Mobile TeleSystems OJSC,Y,Republic of Uzbekistan,Concluded,Y,2012-11-15 00:00:00,Y,Uzbekistan,UZB,pycountry,2012,11,15,No
732,934,ARB/12/34,Tullow Uganda Operations Pty Ltd,Y,Republic of Uganda,Concluded,Y,2012-10-31 00:00:00,Y,Uganda,UGA,pycountry,2012,10,31,Yes
733,935,ARB/12/33,UAB E energija (Lithuania),Y,Republic of Latvia,Concluded,Y,2012-10-15 00:00:00,Y,Latvia,LVA,pycountry,2012,10,15,No
734,938,ARB/12/32,Gelsenwasser AG,Y,People's Democratic Republic of Algeria,Concluded,Y,2012-10-09 00:00:00,Y,Algeria,DZA,pycountry,2012,10,9,No
735,939,ARB/12/31,"Guardian Fiduciary Trust, Ltd, f/k/a Capital Conservator Savings & Loan, Ltd",Y,"Macedonia, former Yugoslav Republic of",Concluded,Y,2012-10-05 00:00:00,Y,North Macedonia,MKD,alias,2012,10,5,No
736,940,ARB/12/30,Lundin Tunisia B. V.,Y,Republic of Tunisia ,Concluded,Y,2012-10-02 00:00:00,Y,Tunisia,TUN,pycountry,2012,10,2,Yes
737,941,ARB/12/29,"Ping An Life Insurance Company of China, Limited and Ping An Insurance (Group) Company of China, Limited",Y,Kingdom of Belgium,Concluded,Y,2012-09-19 00:00:00,Y,Belgium,BEL,pycountry,2012,9,19,No
738,942,ARB(AF)/12/6,Lao Holdings N.V. ,Y,Lao People’s Democratic Republic ,Concluded,Y,2012-09-12 00:00:00,Y,Laos,,alias,2012,9,12,No
740,944,ARB/12/27,Bidzina Ivanishvili,Y,Georgia,Concluded,Y,2012-09-10 00:00:00,Y,Georgia,GEO,pycountry,2012,9,10,No
741,945,ARB/12/26,Sudapet Company Limited,Y,Republic of South Sudan,Concluded,Y,2012-08-29 00:00:00,Y,South Sudan,SSD,pycountry,2012,8,29,Yes
742,946,ARB/12/25,Marco Gavazzi and Stefano Gavazzi ,Y,Romania,Concluded,Y,2012-08-27 00:00:00,Y,Romania,ROU,pycountry,2012,8,27,No
743,948,ARB/12/24,Transban Investments Corp.,Y,Bolivarian Republic of Venezuela,Concluded,Y,2012-08-27 00:00:00,Y,"Venezuela, Bolivarian Republic of",VEN,pycountry,2012,8,27,No
744,949,ARB/12/23,Tenaris S.A. and Talta - Trading e Marketing Sociedade Unipessoal Lda.,Y,Bolivarian Republic of Venezuela,Concluded,Y,2012-08-21 00:00:00,Y,"Venezuela, Bolivarian Republic of",VEN,pycountry,2012,8,21,No
745,951,ARB/12/22,Venoklim Holding B.V.,Y,Bolivarian Republic of Venezuela,Concluded,Y,2012-08-15 00:00:00,Y,"Venezuela, Bolivarian Republic of",VEN,pycountry,2012,8,15,No
746,953,ARB/12/21,"Fábrica de Vidrios Los Andes, C.A. and Owens-Illinois de Venezuela, C.A.",Y,Bolivarian Republic of Venezuela,Concluded,Y,2012-08-10 00:00:00,Y,"Venezuela, Bolivarian Republic of",VEN,pycountry,2012,8,10,No
747,955,ARB/12/20,Blue Bank International & Trust (Barbados) Ltd.,Y,Bolivarian Republic of Venezuela,Concluded,Y,2012-08-07 00:00:00,Y,"Venezuela, Bolivarian Republic of",VEN,pycountry,2012,8,7,No
748,957,ARB/12/19,Ternium S.A. and Consorcio Siderurgia Amazonia S.L.,Y,Bolivarian Republic of Venezuela,Concluded,Y,2012-08-01 00:00:00,Y,"Venezuela, Bolivarian Republic of",VEN,pycountry,2012,8,1,No
749,958,ARB(AF)/12/5,Rusoro Mining Ltd.,Y,Bolivarian Republic of Venezuela,Concluded,Y,2012-08-01 00:00:00,Y,"Venezuela, Bolivarian Republic of",VEN,pycountry,2012,8,1,Yes
750,959,ARB/12/18,Valle Verde Sociedad Financiera S.L. ,Y,Bolivarian Republic of Venezuela,Concluded,Y,2012-07-25 00:00:00,Y,"Venezuela, Bolivarian Republic of",VEN,pycountry,2012,7,25,No
751,960,ARB/12/17,"Inversión y Gestión de Bienes, IGB, S.L. and IGB18 Las Rozas, S.L.",Y,Kingdom of Spain ,Concluded,Y,2012-07-09 00:00:00,Y,Spain,ESP,pycountry,2012,7,9,No
752,961,ARB/12/16,"Novera AD, Novera Properties B.V. and Novera Properties N.V.",Y,Republic of Bulgaria,Concluded,Y,2012-07-03 00:00:00,Y,Bulgaria,BGR,pycountry,2012,7,3,No
754,963,ARB/12/15,Veolia Propreté,Y,Arab Republic of Egypt,Concluded,Y,2012-06-25 00:00:00,Y,Egypt,EGY,pycountry,2012,6,25,No
755,964,ARB/12/14 and 12/40,"Churchill Mining Plc and Planet Mining Pty Ltd, formerly ARB/12/14",Y,Republic of Indonesia,Concluded,Y,2012-06-22 00:00:00,Y,Indonesia,IDN,pycountry,2012,6,22,Yes
756,966,ARB(AF)/12/4,Telefónica S.A. ,Y,United Mexican States ,Concluded,Y,2012-06-21 00:00:00,Y,Mexico,MEX,pycountry,2012,6,21,No
757,967,ARB/12/13,Saint-Gobain Performance Plastics Europe,Y,Bolivarian Republic of Venezuela,Concluded,Y,2012-06-15 00:00:00,Y,"Venezuela, Bolivarian Republic of",VEN,pycountry,2012,6,15,No
758,969,ARB/12/12,Vattenfall AB and others,Y,Federal Republic of Germany ,Concluded,Y,2012-05-31 00:00:00,Y,Germany,DEU,pycountry,2012,5,31,No
759,970,ARB/12/11,Ampal-American Israel Corporation and others,Y,Arab Republic of Egypt,Concluded,Y,2012-05-23 00:00:00,Y,Egypt,EGY,pycountry,2012,5,23,Yes
760,971,ARB(AF)/12/3,"Mercer International, Inc.",Y,Canada,Concluded,Y,2012-05-16 00:00:00,Y,Canada,CAN,pycountry,2012,5,16,No
761,973,CONC(AF)/12/1,"Hess Equatorial Guinea, Inc. and Tullow Equatorial Guinea Limited",Y,Republic of Equatorial Guinea,Pending,Y,2012-05-15 00:00:00,Y,Equatorial Guinea,GNQ,pycountry,2012,5,15,Yes
762,974,ARB/12/10,RSM Production Corporation,Y,Saint Lucia,Concluded,Y,2012-04-23 00:00:00,Y,Saint Lucia,LCA,pycountry,2012,4,23,Yes
763,977,ARB/12/9,Dan Cake (Portugal) S.A.,Y,Hungary ,Concluded,Y,2012-04-19 00:00:00,Y,Hungary,HUN,pycountry,2012,4,19,No
764,980,ARB/12/8,Société Industrielle des Boissons de Guinée,Y,Republic of Guinea,Concluded,Y,2012-04-05 00:00:00,Y,Guinea,GIN,pycountry,2012,4,5,No
765,981,ARB/12/7,"Slovak Gas Holding BV, GDF International SAS and E.ON Ruhrgas International GmbH",Y,Slovak Republic,Concluded,Y,2012-04-05 00:00:00,Y,Slovakia,SVK,pycountry,2012,4,5,Yes
766,982,ARB/12/6,Muhammet Ҫap & Bankrupt Sehil Inşaat Endustri ve Ticaret Ltd. Sti.,Y,Turkmenistan,Concluded,Y,2012-03-26 00:00:00,Y,Turkmenistan,TKM,pycountry,2012,3,26,No
767,983,ARB(AF)/12/2,Grupo Francisco Hernando Contreras,Y,Republic of Equatorial Guinea,Concluded,Y,2012-03-23 00:00:00,Y,Equatorial Guinea,GNQ,pycountry,2012,3,23,No
768,984,ARB(AF)/12/1,Apotex Holdings Inc. and Apotex Inc. ,Y,United States of America,Concluded,Y,2012-03-16 00:00:00,Y,United States,USA,pycountry,2012,3,16,No
769,985,ARB/12/5,Isolux Corsán Concesiones S.A.,Y,Republic of Peru,Concluded,Y,2012-02-15 00:00:00,Y,Peru,PER,pycountry,2012,2,15,No
770,986,ARB/12/4,Supervision y Control S.A.,Y,Republic of Costa Rica,Concluded,Y,2012-02-09 00:00:00,Y,Costa Rica,CRI,pycountry,2012,2,9,No
771,987,ARB/12/3,Accession Mezzanine Capital L.P. and Danubius Kereskedöház Vagyonkezelö Zrt.,Y,Hungary ,Concluded,Y,2012-01-18 00:00:00,Y,Hungary,HUN,pycountry,2012,1,18,No
772,988,ARB/12/2,"Emmis International Holding, B.V., Emmis Radio Operating, B.V., and MEM Magyar Electronic Media Kereskedelmi és Szolgáltató Kft.",Y,Hungary ,Concluded,Y,2012-01-18 00:00:00,Y,Hungary,HUN,pycountry,2012,1,18,No
773,989,ARB/11/33,Adel A Hamadi Al Tamimi,Y,Sultanate of Oman,Concluded,Y,2011-12-23 00:00:00,Y,Oman,OMN,pycountry,2011,12,23,Yes
774,990,ARB/11/32,Indorama International Finance Limited,Y,Arab Republic of Egypt,Concluded,Y,2011-12-02 00:00:00,Y,Egypt,EGY,pycountry,2011,12,2,No
775,991,ARB/11/31,"Gambrinus, Corp.",Y,Bolivarian Republic of Venezuela,Concluded,Y,2011-12-02 00:00:00,Y,"Venezuela, Bolivarian Republic of",VEN,pycountry,2011,12,2,No
776,993,ARB/11/30,Hortensia Margarita Shortt,Y,Bolivarian Republic of Venezuela,Concluded,Y,2011-11-21 00:00:00,Y,"Venezuela, Bolivarian Republic of",VEN,pycountry,2011,11,21,No
777,994,ARB/11/29,Getma International and others,Y,Republic of Guinea,Concluded,Y,2011-11-03 00:00:00,Y,Guinea,GIN,pycountry,2011,11,3,No
778,996,ARB/11/28,Tulip Real Estate and Development Netherlands B.V. ,Y,Republic of Turkey,Concluded,Y,2011-10-28 00:00:00,Y,Turkey,,alias,2011,10,28,No
779,998,ARB/11/27,Baggerwerken Decloedt En Zoon NV,Y,Republic of the Philippines,Concluded,Y,2011-10-11 00:00:00,Y,Philippines,PHL,pycountry,2011,10,11,No
780,999,ARB(AF)/11/4,Mobile TeleSystems OJSC,Y,Turkmenistan,Concluded,Y,2011-10-05 00:00:00,Y,Turkmenistan,TKM,pycountry,2011,10,5,No
781,1000,ARB/11/26,Tenaris S.A. and Talta - Trading e Marketing Sociedade Unipessoal Lda.,Y,Bolivarian Republic of Venezuela,Concluded,Y,2011-09-30 00:00:00,Y,"Venezuela, Bolivarian Republic of",VEN,pycountry,2011,9,30,No
782,1003,ARB/11/25,OI European Group B.V.,Y,Bolivarian Republic of Venezuela,Concluded,Y,2011-09-26 00:00:00,Y,"Venezuela, Bolivarian Republic of",VEN,pycountry,2011,9,26,No
783,1005,CONC/11/1,RSM Production Corporation,Y,Republic of Cameroon ,Concluded,Y,2011-09-19 00:00:00,Y,Cameroon,CMR,pycountry,2011,9,19,Yes
784,1006,ARB/11/24,Mamidoil Jetoil Greek Petroleum Products Societe Anonyme S.A. ,Y,Republic of Albania,Concluded,Y,2011-09-12 00:00:00,Y,Albania,ALB,pycountry,2011,9,12,Yes
785,1008,ARB/11/23,Franck Charles Arif,Y,Republic of Moldova,Concluded,Y,2011-08-23 00:00:00,Y,"Moldova, Republic of",MDA,pycountry,2011,8,23,No
786,1009,ARB/11/22,Vigotop Limited,Y,Hungary ,Concluded,Y,2011-08-04 00:00:00,Y,Hungary,HUN,pycountry,2011,8,4,No
787,1010,ARB/11/21,"DP World Callao S.R.L., P&O Dover (Holding) Limited, and The Peninsular and Oriental Steam Navigation Company",Y,Republic of Peru,Concluded,Y,2011-07-22 00:00:00,Y,Peru,PER,pycountry,2011,7,22,No
788,1011,ARB/11/20,Garanti Koza LLP,Y,Turkmenistan,Concluded,Y,2011-07-20 00:00:00,Y,Turkmenistan,TKM,pycountry,2011,7,20,No
789,1012,ARB/11/19,Koch Minerals Sàrl and Koch Nitrogen International Sàrl,Y,Bolivarian Republic of Venezuela,Concluded,Y,2011-07-19 00:00:00,Y,"Venezuela, Bolivarian Republic of",VEN,pycountry,2011,7,19,No
790,1015,ARB/11/18,Burimi SRL and Eagle Games SH.A,Y,Republic of Albania ,Concluded,Y,2011-07-12 00:00:00,Y,Albania,ALB,pycountry,2011,7,12,No
791,1016,ARB/11/17,Renée Rose Levy de Levi and Gremcitel S.A.,Y,Republic of Peru,Concluded,Y,2011-06-24 00:00:00,Y,Peru,PER,pycountry,2011,6,24,No
792,1017,ARB/11/16,"Hussain Sajwani, Damac Park Avenue for Real Estate Development S.A.E., and Damac Gamsha Bay for Development S.A.E.",Y,Arab Republic of Egypt,Concluded,Y,2011-06-20 00:00:00,Y,Egypt,EGY,pycountry,2011,6,20,No
793,1018,ARB/11/15,Ekran Berhad,Y,People's Republic of China,Concluded,Y,2011-05-24 00:00:00,Y,China,CHN,pycountry,2011,5,24,No
794,1019,ARB/11/14,"Diamond Fields Liberia, Inc.",Y,Republic of Liberia ,Concluded,Y,2011-05-20 00:00:00,Y,Liberia,LBR,pycountry,2011,5,20,Yes
795,1020,ARB/11/13,Rafat Ali Rizvi,Y,Republic of Indonesia,Concluded,Y,2011-05-19 00:00:00,Y,Indonesia,IDN,pycountry,2011,5,19,No
796,1022,ARB/11/12,Fraport AG Frankfurt Airport Services Worldwide,Y,Republic of the Philippines,Concluded,Y,2011-04-27 00:00:00,Y,Philippines,PHL,pycountry,2011,4,27,No
797,1023,ARB(AF)/11/3,"Vincent J. Ryan, Schooner Capital LLC, and Atlantic Investment Partners LLC",Y,Republic of Poland ,Concluded,Y,2011-04-26 00:00:00,Y,Poland,POL,pycountry,2011,4,26,No
798,1024,ARB/11/11,AHS Niger and Menzies Middle East and Africa S.A. ,Y,Republic of Niger,Concluded,Y,2011-04-26 00:00:00,Y,Niger,NER,embedded_pycountry,2011,4,26,No
799,1025,ARB/11/10,"The Williams Companies, International Holdings B.V., WilPro Energy Services (El Furrial) Limited and WilPro Energy Services (Pigap II) Limited",Y,Bolivarian Republic of Venezuela,Concluded,Y,2011-04-20 00:00:00,Y,"Venezuela, Bolivarian Republic of",VEN,pycountry,2011,4,20,Yes
800,1026,ARB/11/9,Caravelí Cotaruse Transmisora de Energía S.A.C.,Y,Republic of Peru ,Concluded,Y,2011-04-15 00:00:00,Y,Peru,PER,pycountry,2011,4,15,No
801,1027,ARB/11/8,Agility for Public Warehousing Company K.S.C.,Y,Islamic Republic of Pakistan,Concluded,Y,2011-03-28 00:00:00,Y,Pakistan,PAK,pycountry,2011,3,28,No
802,1028,ARB/11/7,National Gas S.A.E.,Y,Arab Republic of Egypt,Concluded,Y,2011-03-22 00:00:00,Y,Egypt,EGY,pycountry,2011,3,22,Yes
803,1029,ARB/11/6,Bawabet Al Kuwait Holding Company ,Y,Arab Republic of Egypt,Concluded,Y,2011-03-18 00:00:00,Y,Egypt,EGY,pycountry,2011,3,18,No
804,1030,ARB(AF)/11/2,Crystallex International Corporation,Y,Bolivarian Republic of Venezuela,Concluded,Y,2011-03-09 00:00:00,Y,"Venezuela, Bolivarian Republic of",VEN,pycountry,2011,3,9,Yes
805,1031,ARB/11/5,Longreef Investments A.V.V.,Y,Bolivarian Republic of Venezuela,Concluded,Y,2011-02-23 00:00:00,Y,"Venezuela, Bolivarian Republic of",VEN,pycountry,2011,2,23,No
806,1033,ARB(AF)/11/1,Nova Scotia Power Incorporated,Y,Bolivarian Republic of Venezuela,Concluded,Y,2011-01-26 00:00:00,Y,"Venezuela, Bolivarian Republic of",VEN,pycountry,2011,1,26,Yes
807,1034,ARB/11/4,Club Hotel Loutraki S.A. and Casinos Austria International Holding GMBH,Y,Republic of Serbia,Concluded,Y,2011-01-21 00:00:00,Y,Serbia,SRB,pycountry,2011,1,21,No
808,1035,ARB/11/3,Accession Eastern Europe Capital AB and Mezzanine Management Sweden AB,Y,Republic of Bulgaria,Concluded,Y,2011-01-20 00:00:00,Y,Bulgaria,BGR,pycountry,2011,1,20,No
809,1036,ARB/11/2,Türkiye Petrolleri Anonim Ortaklığı,Y,Republic of Kazakhstan ,Concluded,Y,2011-01-14 00:00:00,Y,Kazakhstan,KAZ,pycountry,2011,1,14,Yes
810,1037,ARB/11/1,Highbury International AVV and Ramstein Trading Inc.,Y,Bolivarian Republic of Venezuela,Concluded,Y,2011-01-05 00:00:00,Y,"Venezuela, Bolivarian Republic of",VEN,pycountry,2011,1,5,Yes
811,1039,ARB/10/25,"Border Timbers Limited, Timber Products International (Private) Limited, and Hangani Development Co. (Private) Limited",Y,Republic of Zimbabwe,Pending,Y,2010-12-20 00:00:00,Y,Zimbabwe,ZWE,pycountry,2010,12,20,No
812,1042,ARB/10/24,İçkale İnşaat Limited Şirketi,Y,Turkmenistan,Concluded,Y,2010-12-20 00:00:00,Y,Turkmenistan,TKM,pycountry,2010,12,20,No
813,1045,ARB/10/23,"TECO Guatemala Holdings, LLC",Y,Republic of Guatemala,Concluded,Y,2010-11-23 00:00:00,Y,Guatemala,GTM,pycountry,2010,11,23,No
814,1051,ARB/10/22,Ömer Dede and Serdar Elhüseyni,Y,Romania ,Concluded,Y,2010-11-19 00:00:00,Y,Romania,ROU,pycountry,2010,11,19,No
815,1052,ARB/10/21,"International Quantum Resources Limited, Frontier SPRL and Compagnie Minière de Sakania SPRL",Y,Democratic Republic of the Congo,Concluded,Y,2010-10-22 00:00:00,Y,Congo,COG,embedded_pycountry,2010,10,22,Yes
817,1055,ARB(AF)/10/1,David Minnotte and Robert Lewis,Y,Republic of Poland,Concluded,Y,2010-09-14 00:00:00,Y,Poland,POL,pycountry,2010,9,14,No
818,1057,ARB/10/19,Flughafen Zürich A.G. and Gestión e Ingeniería IDC S.A.,Y,Bolivarian Republic of Venezuela,Concluded,Y,2010-08-09 00:00:00,Y,"Venezuela, Bolivarian Republic of",VEN,pycountry,2010,8,9,No
819,1059,ARB/10/17,Renée Rose Levy de Levi,Y,Republic of Peru,Concluded,Y,2010-07-20 00:00:00,Y,Peru,PER,pycountry,2010,7,20,No
820,1061,ARB/10/16,AES Corporation and Tau Power B.V.,Y,Republic of Kazakhstan,Concluded,Y,2010-07-20 00:00:00,Y,Kazakhstan,KAZ,pycountry,2010,7,20,No
821,1062,ARB/10/15,Bernhard von Pezold and others,Y,Republic of Zimbabwe,Pending,Y,2010-07-08 00:00:00,Y,Zimbabwe,ZWE,pycountry,2010,7,8,No
822,1065,ARB/10/14,Opic Karimum Corporation,Y,Bolivarian Republic of Venezuela,Concluded,Y,2010-06-16 00:00:00,Y,"Venezuela, Bolivarian Republic of",VEN,pycountry,2010,6,16,Yes
823,1066,ARB/10/13,"Hassan Awdi, Enterprise Business Consultants, Inc. and Alfa El Corporation",Y,Romania,Concluded,Y,2010-06-16 00:00:00,Y,Romania,ROU,pycountry,2010,6,16,No
824,1067,ARB/10/12,Standard Chartered Bank,Y,United Republic of Tanzania,Concluded,Y,2010-06-11 00:00:00,Y,"Tanzania, United Republic of",TZA,pycountry,2010,6,11,No
826,1070,ARB/10/10,Olyana Holdings LLC ,Y,Republic of Rwanda,Concluded,Y,2010-04-16 00:00:00,Y,Rwanda,RWA,embedded_pycountry,2010,4,16,No
827,1071,ARB/10/9,"Universal Compression International Holdings, S.L.U.",Y,Bolivarian Republic of Venezuela,Concluded,Y,2010-04-12 00:00:00,Y,"Venezuela, Bolivarian Republic of",VEN,pycountry,2010,4,12,Yes
828,1072,ARB/10/8,Pan American Energy LLC,Y,Plurinational State of Bolivia,Concluded,Y,2010-04-12 00:00:00,Y,"Bolivia, Plurinational State of",BOL,pycountry,2010,4,12,Yes
829,1073,ARB/10/7,"Philip Morris Brands Sàrl, Philip Morris Products S.A. and Abal Hermanos S.A.",Y,Oriental Republic of Uruguay,Concluded,Y,2010-03-26 00:00:00,Y,Uruguay,URY,embedded_pycountry,2010,3,26,No
830,1075,ARB/10/6,RSM Production Corporation and others ,Y,Grenada ,Concluded,Y,2010-03-16 00:00:00,Y,Grenada,GRD,pycountry,2010,3,16,Yes
831,1076,ARB/10/5,"Tidewater Investment SRL and Tidewater Caribe, C.A.",Y,Bolivarian Republic of Venezuela,Concluded,Y,2010-03-05 00:00:00,Y,"Venezuela, Bolivarian Republic of",VEN,pycountry,2010,3,5,No
832,1079,ARB/10/4,Antoine Abou Lahoud and Leila Bounafeh-Abou Lahoud,Y,Democratic Republic of the Congo,Concluded,Y,2010-03-04 00:00:00,Y,Congo,COG,embedded_pycountry,2010,3,4,No
833,1081,ARB/10/3,Metal-Tech Ltd.,Y,Republic of Uzbekistan,Concluded,Y,2010-02-04 00:00:00,Y,Uzbekistan,UZB,pycountry,2010,2,4,No
834,1082,ARB/10/2,Convial Callao S.A. and CCI - Compañía de Concesiones de Infraestructura S.A.,Y,Republic of Peru,Concluded,Y,2010-02-02 00:00:00,Y,Peru,PER,pycountry,2010,2,2,No
835,1083,ARB/10/1,Kılıç İnşaat İthalat İhracat Sanayi ve Ticaret Anonim Şirketi,Y,Turkmenistan,Concluded,Y,2010-01-19 00:00:00,Y,Turkmenistan,TKM,pycountry,2010,1,19,No
836,1086,ARB/09/23,Corporación Quiport S.A. and others,Y,Republic of Ecuador,Concluded,Y,2009-12-30 00:00:00,Y,Ecuador,ECU,pycountry,2009,12,30,No
837,1087,ARB/09/22,Itera International Energy LLC and Itera Group NV,Y,Georgia,Concluded,Y,2009-12-29 00:00:00,Y,Georgia,GEO,pycountry,2009,12,29,Yes
838,1088,ARB/09/21,"UAB ""ARVI"" ir ko and UAB ""SANITEX""",Y,Republic of Serbia,Concluded,Y,2009-12-18 00:00:00,Y,Serbia,SRB,pycountry,2009,12,18,No
839,1089,ARB(AF)/09/2,"Abengoa, S.A. y COFIDES, S.A.",Y,United Mexican States ,Concluded,Y,2009-12-11 00:00:00,Y,Mexico,MEX,pycountry,2009,12,11,No
840,1090,ARB/09/20,Reinhard Hans Unglaube,Y,Republic of Costa Rica,Concluded,Y,2009-11-11 00:00:00,Y,Costa Rica,CRI,pycountry,2009,11,11,No
841,1091,ARB(AF)/09/1,Gold Reserve Inc.,Y,Bolivarian Republic of Venezuela,Concluded,Y,2009-11-09 00:00:00,Y,"Venezuela, Bolivarian Republic of",VEN,pycountry,2009,11,9,Yes
842,1093,ARB/09/19,Carnegie Minerals (Gambia) Limited,Y,Republic of The Gambia,Concluded,Y,2009-10-23 00:00:00,Y,Gambia,GMB,pycountry,2009,10,23,Yes
843,1095,ARB/09/18,Cambodia Power Company,Y,Kingdom of Cambodia ,Concluded,Y,2009-09-16 00:00:00,Y,Cambodia,KHM,pycountry,2009,9,16,No
844,1096,ARB/09/17,"Commerce Group Corp. and San Sebastian Gold Mines, Inc.",Y,Republic of El Salvador,Concluded,Y,2009-08-21 00:00:00,Y,El Salvador,SLV,pycountry,2009,8,21,Yes
845,1098,ARB/09/16,Swisslion DOO Skopje,Y,"Macedonia, former Yugoslav Republic of",Concluded,Y,2009-08-21 00:00:00,Y,North Macedonia,MKD,alias,2009,8,21,No
846,1099,ARB/09/15,"H&H Enterprises Investments, Inc.",Y,Arab Republic of Egypt,Concluded,Y,2009-08-11 00:00:00,Y,Egypt,EGY,pycountry,2009,8,11,No
847,1101,ARB/09/14,"Mærsk Olie, Algeriet A/S ",Y,People's Democratic Republic of Algeria,Concluded,Y,2009-07-29 00:00:00,Y,Algeria,DZA,pycountry,2009,7,29,Yes
848,1102,ARB/09/13,International Company for Railway Systems (ICRS),Y,Hashemite Kingdom of Jordan,Concluded,Y,2009-07-16 00:00:00,Y,Jordan,JOR,pycountry,2009,7,16,No
849,1103,ARB/09/12,Pac Rim Cayman LLC,Y,Republic of El Salvador ,Concluded,Y,2009-06-15 00:00:00,Y,El Salvador,SLV,pycountry,2009,6,15,Yes
