,caseid,caseno,claimant,isapproved,respondent,status,isapproved,dateregistered,isapproved,country_clean,country_iso3,extraction_method,registration_year,registration_month,registration_day,miningcase
514,593,ARB/17/17,"MetLife, Inc. and MetLife Servicios S.A.",Y,Argentine Republic,Concluded,Y,2017-06-14 00:00:00,Y,Argentina,ARG,pycountry,2017,6,14,No
515,594,ARB/17/16,Carlos Rios and Francisco Javier Rios,Y,Republic of Chile,Concluded,Y,2017-06-13 00:00:00,Y,Chile,CHL,pycountry,2017,6,13,No
516,595,ARB/17/15,Portigon AG,Y,Kingdom of Spain,Concluded,Y,2017-05-22 00:00:00,Y,Spain,ESP,pycountry,2017,5,22,No
517,597,ARB/17/14,"Rockhopper Italia S.p.A., Rockhopper Mediterranean Ltd, and Rockhopper Exploration Plc",Y,Italian Republic,Pending,Y,2017-05-19 00:00:00,Y,Italy,ITA,pycountry,2017,5,19,Yes
518,600,ARB/17/13,"Grenada Private Power Limited and WRB Enterprises, Inc.",Y,Grenada,Concluded,Y,2017-05-15 00:00:00,Y,Grenada,GRD,pycountry,2017,5,15,No
519,601,ARB/17/12,Jochem Bernard Buse,Y,Republic of Panama,Concluded,Y,2017-05-11 00:00:00,Y,Panama,PAN,pycountry,2017,5,11,No
520,602,ARB/17/11,Pawlowski AG and Project Sever s.r.o.,Y,Czech Republic,Concluded,Y,2017-05-03 00:00:00,Y,Czechia,CZE,pycountry,2017,5,3,No
521,604,ADHOC/17/1,Sanum Investments Limited,Y,Lao People’s Democratic Republic,Pending,Y,2017-04-14 00:00:00,Y,Laos,,alias,2017,4,14,No
522,605,ARB/17/10,Itisaluna Iraq LLC and others ,Y,Republic of Iraq,Concluded,Y,2017-04-13 00:00:00,Y,Iraq,IRQ,pycountry,2017,4,13,No
523,606,ARB/17/9,"Lidercón, S.L.",Y,Republic of Peru,Concluded,Y,2017-04-05 00:00:00,Y,Peru,PER,pycountry,2017,4,5,No
524,607,ARB/17/8,"Rizzani de Eccher S.p.A., Obrascón Huarte Lain S.A. and Trevi S.p.A.",Y,State of Kuwait,Concluded,Y,2017-03-03 00:00:00,Y,Kuwait,KWT,pycountry,2017,3,3,No
525,609,ARB/17/7,Agility Public Warehousing Company K.S.C.,Y,Republic of Iraq,Pending,Y,2017-02-24 00:00:00,Y,Iraq,IRQ,pycountry,2017,2,24,No
526,612,ARB/17/6,Anglo-Adriatic Group Limited,Y,Republic of Albania,Concluded,Y,2017-02-17 00:00:00,Y,Albania,ALB,pycountry,2017,2,17,No
527,613,ARB/17/5,Eugene Kazmin,Y,Republic of Latvia,Concluded,Y,2017-02-03 00:00:00,Y,Latvia,LVA,pycountry,2017,2,3,No
528,614,ARB/17/4,Bank of Cyprus Public Company Limited,Y,Hellenic Republic,Concluded,Y,2017-02-02 00:00:00,Y,Greece,GRC,pycountry,2017,2,2,No
529,615,ARB/17/3,Metro de Lima Línea 2 S.A.,Y,Republic of Peru ,Pending,Y,2017-02-01 00:00:00,Y,Peru,PER,pycountry,2017,2,1,No
530,619,ARB/17/2,Mera Investment Fund Limited,Y,Republic of Serbia ,Concluded,Y,2017-01-26 00:00:00,Y,Serbia,SRB,pycountry,2017,1,26,No
531,621,ARB/17/1,Ortiz Construcciones y Proyectos S.A.,Y,People's Democratic Republic of Algeria,Concluded,Y,2017-01-24 00:00:00,Y,Algeria,DZA,pycountry,2017,1,24,No
532,622,ARB(AF)/17/1,Air Canada,Y,Bolivarian Republic of Venezuela,Concluded,Y,2017-01-13 00:00:00,Y,"Venezuela, Bolivarian Republic of",VEN,pycountry,2017,1,13,No
533,624,ARB/16/42,Omega Engineering LLC and Oscar Rivera,Y,Republic of Panama,Concluded,Y,2016-12-30 00:00:00,Y,Panama,PAN,pycountry,2016,12,30,No
534,625,ARB/16/41,Eco Oro Minerals Corp.,Y,Republic of Colombia,Pending,Y,2016-12-29 00:00:00,Y,Colombia,COL,pycountry,2016,12,29,Yes
535,628,ARB/16/40,Saint Patrick Properties Corporation,Y,Bolivarian Republic of Venezuela,Concluded,Y,2016-12-19 00:00:00,Y,"Venezuela, Bolivarian Republic of",VEN,pycountry,2016,12,19,No
536,629,ARB/16/39,VC Holding II S.à.r.l. and others,Y,Italian Republic,Pending,Y,2016-12-06 00:00:00,Y,Italy,ITA,pycountry,2016,12,6,No
537,631,ARB/16/38,"Staur Eiendom AS, EBO Invest AS and Rox Holding AS",Y,Republic of Latvia,Concluded,Y,2016-12-06 00:00:00,Y,Latvia,LVA,pycountry,2016,12,6,No
538,632,ARB/16/37,"LP Egypt Holdings I, LLC, Fund III Egypt, LLC and OMLP Egypt Holdings I, LLC",Y,Arab Republic of Egypt ,Concluded,Y,2016-11-15 00:00:00,Y,Egypt,EGY,pycountry,2016,11,15,No
539,633,ARB/16/36,"Viaduct d.o.o. Portorož, Vladimir Zevnik and Boris Goljevšček",Y,Bosnia and Herzegovina,Concluded,Y,2016-11-15 00:00:00,Y,Bosnia and Herzegovina,BIH,pycountry,2016,11,15,No
540,635,ARB/16/35,Emergofin B.V. and Velbay Holdings Ltd.,Y,Ukraine,Concluded,Y,2016-11-09 00:00:00,Y,Ukraine,UKR,pycountry,2016,11,9,Yes
541,636,ARB/16/34,"Bridgestone Licensing Services, Inc. and Bridgestone Americas, Inc.",Y,Republic of Panama,Concluded,Y,2016-10-28 00:00:00,Y,Panama,PAN,pycountry,2016,10,28,No
542,637,ARB/16/33,APM Terminals Callao S.A.,Y,Republic of Peru ,Concluded,Y,2016-10-11 00:00:00,Y,Peru,PER,pycountry,2016,10,11,No
543,638,ARB(AF)/16/5,América Móvil S.A.B. de C.V.,Y,Republic of Colombia,Concluded,Y,2016-10-03 00:00:00,Y,Colombia,COL,pycountry,2016,10,3,No
544,639,ARB/16/32,Thomas Gosling and others,Y,Republic of Mauritius,Concluded,Y,2016-09-27 00:00:00,Y,Mauritius,MUS,pycountry,2016,9,27,No
545,640,ARB/16/31,UniCredit Bank Austria AG and Zagrebačka Banka d.d.,Y,Republic of Croatia,Concluded,Y,2016-09-16 00:00:00,Y,Croatia,HRV,pycountry,2016,9,16,No
546,641,ARB(AF)/16/4,JSC Tashkent Mechanical Plant and others,Y,Kyrgyz Republic,Concluded,Y,2016-09-06 00:00:00,Y,Kyrgyzstan,KGZ,alias,2016,9,6,No
547,642,ARB/16/30,Görkem Inşaat Sanayi ve Ticaret Limited Şirketi,Y,Turkmenistan,Concluded,Y,2016-08-23 00:00:00,Y,Turkmenistan,TKM,pycountry,2016,8,23,No
548,643,ARB/16/29,AVAX S.A.,Y,Lebanese Republic,Pending,Y,2016-08-17 00:00:00,Y,Lebanon,LBN,pycountry,2016,8,17,No
549,645,ARB/16/28,Amlyn Holding B.V. ,Y,Republic of Croatia,Concluded,Y,2016-08-17 00:00:00,Y,Croatia,HRV,pycountry,2016,8,17,No
550,646,ARB/16/27,Sevilla Beheer B.V. and others,Y,Kingdom of Spain,Concluded,Y,2016-08-12 00:00:00,Y,Spain,ESP,pycountry,2016,8,12,No
551,648,ARB(AF)/16/3,"B-Mex, LLC and others",Y,United Mexican States,Concluded,Y,2016-08-11 00:00:00,Y,Mexico,MEX,pycountry,2016,8,11,No
552,649,ARB/16/26,Oleovest Pte. Ltd.,Y,Republic of Indonesia,Concluded,Y,2016-08-10 00:00:00,Y,Indonesia,IDN,pycountry,2016,8,10,No
553,650,ARB/16/25,Raymond Charles Eyre and Montrose Developments (Private) Limited,Y,Democratic Socialist Republic of Sri Lanka,Concluded,Y,2016-08-04 00:00:00,Y,Sri Lanka,LKA,pycountry,2016,8,4,No
554,652,ARB/16/24,"ČEZ, a.s.",Y,Republic of Bulgaria,Pending,Y,2016-07-26 00:00:00,Y,Bulgaria,BGR,pycountry,2016,7,26,No
555,654,ARB/16/23,"Agroinsumos Ibero-Americanos, S.L. and others",Y,Bolivarian Republic of Venezuela,Concluded,Y,2016-07-25 00:00:00,Y,"Venezuela, Bolivarian Republic of",VEN,pycountry,2016,7,25,No
556,658,ARB/16/22,Prime Energy Resources Development B.V. (formerly Shell Philippines Exploration B.V.),Y,Republic of the Philippines,Pending,Y,2016-07-20 00:00:00,Y,Philippines,PHL,pycountry,2016,7,20,Yes
557,659,ARB/16/21,TransCanada Corporation and TransCanada PipeLines Limited,Y,United States of America,Concluded,Y,2016-07-15 00:00:00,Y,United States,USA,pycountry,2016,7,15,Yes
558,660,ARB/16/20,Iskandar Safa and Akram Safa,Y,Hellenic Republic,Concluded,Y,2016-07-05 00:00:00,Y,Greece,GRC,pycountry,2016,7,5,No
559,662,ARB/16/19,"Nova Group Investments, B.V.",Y,Romania,Concluded,Y,2016-07-05 00:00:00,Y,Romania,ROU,pycountry,2016,7,5,No
560,663,ARB/16/18,Infracapital F1 S.à r.l. and Infracapital Solar B.V.,Y,Kingdom of Spain,Concluded,Y,2016-06-29 00:00:00,Y,Spain,ESP,pycountry,2016,6,29,No
561,667,ARB/16/17,Sun-Flower Olmeda GmbH & Co KG and others,Y,Kingdom of Spain,Concluded,Y,2016-06-28 00:00:00,Y,Spain,ESP,pycountry,2016,6,28,No
562,669,ARB/16/16,Global Telecom Holding S.A.E. ,Y,Canada,Concluded,Y,2016-06-06 00:00:00,Y,Canada,CAN,pycountry,2016,6,6,No
563,672,UNCT/02/1,United Parcels Service of America Inc.,Y,Canada,Concluded,Y,2000-04-19 00:00:00,Y,Canada,CAN,pycountry,2000,4,19,No
564,673,ARB(AF)/16/2,Lao Holdings N.V.,Y,Lao People’s Democratic Republic,Pending,Y,2016-05-27 00:00:00,Y,Laos,,alias,2016,5,27,No
565,674,CONC/16/1,Xenofon Karagiannis,Y,Republic of Albania,Pending,Y,2016-05-16 00:00:00,Y,Albania,ALB,pycountry,2016,5,16,No
566,675,ARB(AF)/16/1,Luis García Armas,Y,Bolivarian Republic of Venezuela,Concluded,Y,2016-05-05 00:00:00,Y,"Venezuela, Bolivarian Republic of",VEN,pycountry,2016,5,5,No
567,676,ARB/16/15,AngloGold Ashanti (Ghana) Limited,Y,Republic of Ghana,Concluded,Y,2016-05-02 00:00:00,Y,Ghana,GHA,pycountry,2016,5,2,Yes
568,677,ARB/16/14,"ENGIE SA, GDF International SAS and ENGIE International Holdings BV",Y,Hungary,Concluded,Y,2016-04-20 00:00:00,Y,Hungary,HUN,pycountry,2016,4,20,Yes
569,678,ARB/16/13,Dominion Minerals Corp.,Y,Republic of Panama,Concluded,Y,2016-04-15 00:00:00,Y,Panama,PAN,pycountry,2016,4,15,Yes
570,680,UNCT/07/1,Merrill & Ring Forestry L.P.,Y,Canada,Concluded,Y,2006-12-27 00:00:00,Y,Canada,CAN,pycountry,2006,12,27,No
571,681,ARB/16/12,Alhambra Resources Ltd. and Alhambra Coӧperatief U.A.,Y,Republic of Kazakhstan,Pending,Y,2016-04-05 00:00:00,Y,Kazakhstan,KAZ,pycountry,2016,4,5,Yes
572,685,ARB/16/11,"Société Resort Company Invest Abidjan, Stanislas Citerici and Gérard Bot",Y,Republic of Côte d'Ivoire,Concluded,Y,2016-03-29 00:00:00,Y,Côte d'Ivoire,CIV,pycountry,2016,3,29,No
573,686,ARB/16/10,Kunsttrans Holding GmbH and Kunsttrans d.o.o. Beograd,Y,Republic of Serbia,Concluded,Y,2016-03-28 00:00:00,Y,Serbia,SRB,pycountry,2016,3,28,No
574,687,ARB/16/9,Italba Corporation,Y,Oriental Republic of Uruguay,Concluded,Y,2016-03-24 00:00:00,Y,Uruguay,URY,embedded_pycountry,2016,3,24,No
575,689,ARB/16/8,Zbigniew Piotr Grot and others,Y,Republic of Moldova,Concluded,Y,2016-03-21 00:00:00,Y,"Moldova, Republic of",MDA,pycountry,2016,3,21,No
576,690,ARB/16/7,Attila Doğan Construction & Installation Co. Inc.,Y,Sultanate of Oman,Concluded,Y,2016-03-21 00:00:00,Y,Oman,OMN,pycountry,2016,3,21,Yes
577,692,ARB/16/6,Glencore International A.G. and C.I. Prodeco S.A.,Y,Republic of Colombia,Concluded,Y,2016-03-16 00:00:00,Y,Colombia,COL,pycountry,2016,3,16,Yes
578,694,ARB/16/5,"ESPF Beteiligungs GmbH, ESPF Nr. 2 Austria Beteiligungs GmbH, and InfraClass Energie 5 GmbH & Co. KG",Y,Italian Republic,Concluded,Y,2016-03-08 00:00:00,Y,Italy,ITA,pycountry,2016,3,8,No
579,696,ARB/16/4,Eurus Energy Holdings Corporation,Y,Kingdom of Spain,Concluded,Y,2016-03-01 00:00:00,Y,Spain,ESP,pycountry,2016,3,1,No
580,699,ARB/16/3,Veolia Environnement S.A. and others,Y,Republic of Lithuania,Concluded,Y,2016-02-10 00:00:00,Y,Lithuania,LTU,pycountry,2016,2,10,No
581,700,ARB/16/2,Champion Holding Company and others,Y,Arab Republic of Egypt,Concluded,Y,2016-01-28 00:00:00,Y,Egypt,EGY,pycountry,2016,1,28,No
582,701,ARB/16/1,Al Jazeera Media Network,Y,Arab Republic of Egypt,Concluded,Y,2016-01-20 00:00:00,Y,Egypt,EGY,pycountry,2016,1,20,No
583,702,ARB(AF)/15/2,Lion Mexico Consolidated L.P.,Y,United Mexican States,Concluded,Y,2015-12-23 00:00:00,Y,Mexico,MEX,pycountry,2015,12,23,No
584,703,ARB/15/50,Eskosol S.p.A. in liquidazione,Y,Italian Republic,Concluded,Y,2015-12-22 00:00:00,Y,Italy,ITA,pycountry,2015,12,22,No
585,704,ARB/15/49,Theodoros Adamakopoulos and others,Y,Republic of Cyprus,Concluded,Y,2015-12-17 00:00:00,Y,Cyprus,CYP,pycountry,2015,12,17,No
586,705,ARB/15/48,"Abertis Infraestructuras, S.A.",Y,Argentine Republic,Concluded,Y,2015-12-17 00:00:00,Y,Argentina,ARG,pycountry,2015,12,17,No
587,706,ARB/15/47,ArcelorMittal S.A.,Y,Arab Republic of Egypt,Concluded,Y,2015-12-09 00:00:00,Y,Egypt,EGY,pycountry,2015,12,9,No
588,707,ARB/15/46,BSG Resources (Guinea) Limited and BSG Resources (Guinea) SÀRL,Y,Republic of Guinea,Concluded,Y,2015-11-25 00:00:00,Y,Guinea,GIN,pycountry,2015,11,25,Yes
589,708,ARB/15/45,Landesbank Baden-Württemberg and others,Y,Kingdom of Spain,Pending,Y,2015-11-12 00:00:00,Y,Spain,ESP,pycountry,2015,11,12,No
590,709,ARB/15/44,Watkins Holdings S.à r.l. and others,Y,Kingdom of Spain,Concluded,Y,2015-11-04 00:00:00,Y,Spain,ESP,pycountry,2015,11,4,No
591,713,ARB/15/43,State General Reserve Fund of the Sultanate of Oman,Y,Republic of Bulgaria,Concluded,Y,2015-10-22 00:00:00,Y,Bulgaria,BGR,pycountry,2015,10,22,No
592,714,ARB/15/42,Hydro Energy 1 S.à r.l. and Hydroxana Sweden AB,Y,Kingdom of Spain,Concluded,Y,2015-10-19 00:00:00,Y,Spain,ESP,pycountry,2015,10,19,No
593,716,ARB/15/41,Standard Chartered Bank (Hong Kong) Limited,Y,United Republic of Tanzania,Concluded,Y,2015-09-30 00:00:00,Y,"Tanzania, United Republic of",TZA,pycountry,2015,9,30,No
594,717,ARB/15/40,Belenergia S.A.,Y,Italian Republic,Concluded,Y,2015-09-22 00:00:00,Y,Italy,ITA,pycountry,2015,9,22,No
595,718,ARB/15/39,Webuild S.p.A. (formerly Salini Impregilo S.p.A.),Y,Argentine Republic,Pending,Y,2015-09-17 00:00:00,Y,Argentina,ARG,pycountry,2015,9,17,No
596,723,UNCT/15/3,David Aven et al.,Y,Republic of Costa Rica,Concluded,Y,2014-01-24 00:00:00,Y,Costa Rica,CRI,pycountry,2014,1,24,No
597,724,ARB/15/38,SolEs Badajoz GmbH,Y,Kingdom of Spain,Concluded,Y,2015-08-24 00:00:00,Y,Spain,ESP,pycountry,2015,8,24,No
598,727,ARB/15/37,Silver Ridge Power BV,Y,Italian Republic,Concluded,Y,2015-08-11 00:00:00,Y,Italy,ITA,pycountry,2015,8,11,No
599,728,ARB/15/36,OperaFund Eco-Invest SICAV PLC and Schwab Holding AG,Y,Kingdom of Spain,Concluded,Y,2015-08-11 00:00:00,Y,Spain,ESP,pycountry,2015,8,11,No
600,731,ARB/15/35,"E.ON SE, E.ON Finanzanlagen GmbH and E.ON Iberia Holding GmbH",Y,Kingdom of Spain,Pending,Y,2015-08-10 00:00:00,Y,Spain,ESP,pycountry,2015,8,10,No
601,733,ARB/15/34,"Cavalum SGPS, S.A.",Y,Kingdom of Spain,Concluded,Y,2015-08-04 00:00:00,Y,Spain,ESP,pycountry,2015,8,4,No
602,737,ARB/15/33,Gilward Investments B.V.,Y,Ukraine,Concluded,Y,2015-07-31 00:00:00,Y,Ukraine,UKR,pycountry,2015,7,31,No
603,738,ARB/15/32,B.V. Belegging-Maatschappij “Far East”,Y,Republic of Austria,Concluded,Y,2015-07-30 00:00:00,Y,Austria,AUT,pycountry,2015,7,30,No
604,739,ARB/15/31,Gabriel Resources Ltd. and Gabriel Resources (Jersey),Y,Romania,Pending,Y,2015-07-30 00:00:00,Y,Romania,ROU,pycountry,2015,7,30,Yes
605,741,ARB(AF)/15/1,Strabag SE ,Y,Libya,Concluded,Y,2015-07-20 00:00:00,Y,Libya,LBY,pycountry,2015,7,20,No
606,742,ARB/15/30,"Samsung Engineering Co., Ltd.",Y,Sultanate of Oman,Concluded,Y,2015-07-20 00:00:00,Y,Oman,OMN,pycountry,2015,7,20,No
607,743,ARB/15/29,"Cortec Mining Kenya Limited, Cortec (Pty) Limited and Stirling Capital Limited",Y,Republic of Kenya,Concluded,Y,2015-07-07 00:00:00,Y,Kenya,KEN,pycountry,2015,7,7,Yes
608,745,ARB/15/28,Hydro S.r.l. and others,Y,Republic of Albania,Concluded,Y,2015-06-29 00:00:00,Y,Albania,ALB,pycountry,2015,6,29,No
609,749,ARB/15/27,JGC Holdings Corporation (formerly JGC Corporation),Y,Kingdom of Spain,Concluded,Y,2015-06-22 00:00:00,Y,Spain,ESP,pycountry,2015,6,22,No
610,751,ARB/15/26,Nabucco Gas Pipeline International GmbH in Liqu.,Y,Republic of Turkey,Concluded,Y,2015-06-16 00:00:00,Y,Turkey,,alias,2015,6,16,Yes
611,752,ARB/15/25,KS Invest GmbH and TLS Invest GmbH,Y,Kingdom of Spain,Pending,Y,2015-06-16 00:00:00,Y,Spain,ESP,pycountry,2015,6,16,No
612,754,ARB/15/24,Ali Alyafei,Y,Hashemite Kingdom of Jordan,Concluded,Y,2015-06-11 00:00:00,Y,Jordan,JOR,pycountry,2015,6,11,No
613,755,ARB/15/23,Mathias Kruck and others,Y,Kingdom of Spain ,Concluded,Y,2015-06-04 00:00:00,Y,Spain,ESP,pycountry,2015,6,4,No
614,757,ARB/15/22,ACP Axos Capital GmbH,Y,Republic of Kosovo,Concluded,Y,2015-06-04 00:00:00,Y,Kosovo,,alias,2015,6,4,No
615,758,ARB/15/21,Menzies Middle East and Africa S.A. and Aviation Handling Services International Ltd.,Y,Republic of Senegal,Concluded,Y,2015-06-01 00:00:00,Y,Senegal,SEN,pycountry,2015,6,1,No
616,759,ARB/15/20,Cube Infrastructure Fund SICAV and others,Y,Kingdom of Spain ,Concluded,Y,2015-06-01 00:00:00,Y,Spain,ESP,pycountry,2015,6,1,No
617,761,ARB/15/19,ENERGO-PRO a.s.,Y,Republic of Bulgaria,Concluded,Y,2015-05-26 00:00:00,Y,Bulgaria,BGR,pycountry,2015,5,26,No
618,762,ARB/15/18,Capital Financial Holdings Luxembourg S.A.,Y,Republic of Cameroon,Concluded,Y,2015-05-20 00:00:00,Y,Cameroon,CMR,pycountry,2015,5,20,No
619,764,ARB/15/17,Hanocal Holding B.V. and IPIC International B.V.,Y,Republic of Korea,Concluded,Y,2015-05-20 00:00:00,Y,South Korea,,alias,2015,5,20,Yes
620,765,ARB/15/16,BayWa r.e. AG,Y,Kingdom of Spain,Concluded,Y,2015-05-08 00:00:00,Y,Spain,ESP,pycountry,2015,5,8,No
621,767,ARB/15/15,9REN Holding S.a.r.l,Y,Kingdom of Spain,Concluded,Y,2015-04-21 00:00:00,Y,Spain,ESP,pycountry,2015,4,21,No
622,770,UNCT/15/2,Lone Pine Resources Inc.,Y,Canada,Concluded,Y,2013-09-06 00:00:00,Y,Canada,CAN,pycountry,2013,9,6,Yes
623,771,ARB/15/14,Álvarez y Marín Corporación S.A. and others,Y,Republic of Panama,Concluded,Y,2015-04-20 00:00:00,Y,Panama,PAN,pycountry,2015,4,20,No
624,772,ARB/15/13,Devincci Salah Hourani and Issam Salah Hourani,Y,Republic of Kazakhstan,Concluded,Y,2015-04-16 00:00:00,Y,Kazakhstan,KAZ,pycountry,2015,4,16,No
625,773,ARB/15/12,"PT Ventures, SGPS, S.A.",Y,Republic of Cabo Verde,Concluded,Y,2015-04-14 00:00:00,Y,Cabo Verde,CPV,pycountry,2015,4,14,No
626,774,UNCT/15/1,A11Y LTD.,Y,Czech Republic,Concluded,Y,2015-01-16 00:00:00,Y,Czechia,CZE,pycountry,2015,1,16,No
627,775,ARB/15/11,Total E&P Uganda BV,Y,Republic of Uganda,Concluded,Y,2015-03-20 00:00:00,Y,Uganda,UGA,pycountry,2015,3,20,Yes
628,776,ARB/15/10,Orange SA,Y,Hashemite Kingdom of Jordan,Concluded,Y,2015-03-13 00:00:00,Y,Jordan,JOR,pycountry,2015,3,13,No
629,777,ARB/15/9,Poltava Gas B.V. and Poltava Petroleum Company,Y,Ukraine,Concluded,Y,2015-03-11 00:00:00,Y,Ukraine,UKR,pycountry,2015,3,11,Yes
630,778,ARB/15/8,Aktau Petrol Ticaret A.Ş.,Y,Republic of Kazakhstan,Concluded,Y,2015-03-06 00:00:00,Y,Kazakhstan,KAZ,pycountry,2015,3,6,Yes
631,780,ARB/15/7,WalAm Energy LLC,Y,Republic of Kenya,Concluded,Y,2015-02-23 00:00:00,Y,Kenya,KEN,pycountry,2015,2,23,No
632,782,UNCT/10/2,Apotex Inc.,Y,United States of America,Concluded,Y,2008-12-10 00:00:00,Y,United States,USA,pycountry,2008,12,10,No
633,783,UNCT/10/1,AbitibiBowater Inc.,Y,Canada,Concluded,Y,2010-02-25 00:00:00,Y,Canada,CAN,pycountry,2010,2,25,No
634,784,ARB/15/6,Mobil Investments Canada Inc.,Y,Canada,Concluded,Y,2015-02-18 00:00:00,Y,Canada,CAN,pycountry,2015,2,18,Yes
635,785,ARB/15/5,B3 Croatian Courier Coöperatief U.A. ,Y,Republic of Croatia ,Concluded,Y,2015-02-03 00:00:00,Y,Croatia,HRV,pycountry,2015,2,3,No
636,786,ARB/15/4,STEAG GmbH,Y,Kingdom of Spain ,Concluded,Y,2015-01-21 00:00:00,Y,Spain,ESP,pycountry,2015,1,21,No
637,788,ARB/15/3,Abed El Jaouni,Y,Lebanese Republic,Concluded,Y,2015-01-16 00:00:00,Y,Lebanon,LBN,pycountry,2015,1,16,No
638,790,ARB/15/2,"Lighthouse Corporation Pty Ltd and Lighthouse Corporation Ltd, IBC",Y,Democratic Republic of Timor-Leste,Concluded,Y,2015-01-14 00:00:00,Y,Timor-Leste,TLS,pycountry,2015,1,14,Yes
639,791,ARB/15/1,"Stadtwerke München GmbH, RWE Innogy GmbH, and others",Y,Kingdom of Spain,Concluded,Y,2015-01-07 00:00:00,Y,Spain,ESP,pycountry,2015,1,7,No
641,795,ARB/14/34,RWE Innogy GmbH and RWE Innogy Aersa S.A.U.,Y,Kingdom of Spain,Concluded,Y,2014-12-23 00:00:00,Y,Spain,ESP,pycountry,2014,12,23,No
642,797,ARB/14/33,"IBT Group, LLC, Constructor, Consulting and Engineering (Panamá), S.A., and International Business and Trade, LLC.",Y,Republic of Panama,Concluded,Y,2014-12-19 00:00:00,Y,Panama,PAN,pycountry,2014,12,19,No
643,798,ARB/14/32,Casinos Austria International GmbH and Casinos Austria Aktiengesellschaft,Y,Argentine Republic,Concluded,Y,2014-12-18 00:00:00,Y,Argentina,ARG,pycountry,2014,12,18,No
644,800,ARB/14/31,Tariq Bashir and SA Interpétrol Burundi,Y,Republic of Burundi,Concluded,Y,2014-12-12 00:00:00,Y,Burundi,BDI,pycountry,2014,12,12,Yes
645,801,ARB/12/39,Georg Gavrilović and Gavrilović d.o.o.,Y,Republic of Croatia,Concluded,Y,2012-12-21 00:00:00,Y,Croatia,HRV,pycountry,2012,12,21,No
646,802,ARB/14/30,Beijing Urban Construction Group Co. Ltd.,Y,Republic of Yemen,Concluded,Y,2014-12-03 00:00:00,Y,Yemen,YEM,pycountry,2014,12,3,No
647,803,ARB/14/29,"Ioan Micula, Viorel Micula and others",Y,Romania,Concluded,Y,2014-11-24 00:00:00,Y,Romania,ROU,pycountry,2014,11,24,No
648,805,ARB/14/28,Alpiq AG,Y,Romania ,Concluded,Y,2014-11-17 00:00:00,Y,Romania,ROU,pycountry,2014,11,17,No
649,808,ARB/14/27,Zelena N.V. and Energo-Zelena d.o.o Inđija,Y,Republic of Serbia,Concluded,Y,2014-11-07 00:00:00,Y,Serbia,SRB,pycountry,2014,11,7,No
650,809,ARB/14/26,"Albaniabeg Ambient Sh.p.k, M. Angelo Novelli and Costruzioni S.r.l.",Y,Republic of Albania ,Concluded,Y,2014-11-07 00:00:00,Y,Albania,ALB,pycountry,2014,11,7,No
651,811,ARB/14/25,"Ansung Housing Co., Ltd.",Y,People's Republic of China ,Concluded,Y,2014-11-04 00:00:00,Y,China,CHN,pycountry,2014,11,4,No
653,814,ARB/14/24,United Utilities (Tallinn) B.V. and Aktsiaselts Tallinna Vesi,Y,Republic of Estonia,Concluded,Y,2014-10-24 00:00:00,Y,Estonia,EST,pycountry,2014,10,24,No
654,815,ARB/14/23,Tamagot Bumi S.A. and Bumi Mauritania S.A.,Y,Islamic Republic of Mauritania,Concluded,Y,2014-10-20 00:00:00,Y,Mauritania,MRT,pycountry,2014,10,20,Yes
655,816,ARB/12/1,Tethyan Copper Company Pty Limited,Y,Islamic Republic of Pakistan,Concluded,Y,2012-01-12 00:00:00,Y,Pakistan,PAK,pycountry,2012,1,12,Yes
656,819,ARB(AF)/00/2,"Técnicas Medioambientales Tecmed, S.A.",Y,United Mexican States ,Concluded,Y,2000-08-28 00:00:00,Y,Mexico,MEX,pycountry,2000,8,28,No
657,820,ARB/14/22,"BSG Resources Limited (in administration), BSG Resources (Guinea) Limited and BSG Resources (Guinea) SÀRL",Y,Republic of Guinea,Concluded,Y,2014-09-08 00:00:00,Y,Guinea,GIN,pycountry,2014,9,8,Yes
658,822,ARB/14/21,Bear Creek Mining Corporation,Y,Republic of Peru,Concluded,Y,2014-08-18 00:00:00,Y,Peru,PER,pycountry,2014,8,18,Yes
659,823,ARB/14/20,Sodexo Pass International SAS,Y,Hungary,Concluded,Y,2014-08-15 00:00:00,Y,Hungary,HUN,pycountry,2014,8,15,No
660,825,ARB/14/19,Vicat S.A.,Y,Republic of Senegal,Concluded,Y,2014-08-05 00:00:00,Y,Senegal,SEN,pycountry,2014,8,5,No
661,826,ARB/14/18,RENERGY S.à r.l. ,Y,Kingdom of Spain,Concluded,Y,2014-08-01 00:00:00,Y,Spain,ESP,pycountry,2014,8,1,No
662,828,ARB(AF)/14/3,"Corona Materials, LLC ",Y,Dominican Republic,Concluded,Y,2014-07-30 00:00:00,Y,Dominican Republic,DOM,pycountry,2014,7,30,Yes
663,829,ARB/14/17,Krederi Ltd.,Y,Ukraine,Concluded,Y,2014-07-21 00:00:00,Y,Ukraine,UKR,pycountry,2014,7,21,No
664,830,ARB/14/16,Cyprus Popular Bank Public Co. Ltd.,Y,Hellenic Republic,Pending,Y,2014-07-16 00:00:00,Y,Greece,GRC,pycountry,2014,7,16,No
665,832,ARB/14/15,Nusa Tenggara Partnership B.V. and PT Newmont Nusa Tenggara,Y,Republic of Indonesia,Concluded,Y,2014-07-15 00:00:00,Y,Indonesia,IDN,pycountry,2014,7,15,Yes
666,833,ARB/14/14,EuroGas Inc. and Belmont Resources Inc.,Y,Slovak Republic,Concluded,Y,2014-07-10 00:00:00,Y,Slovakia,SVK,pycountry,2014,7,10,Yes
667,835,ARB(AF)/14/2,Oded Besserglik,Y,Republic of Mozambique,Concluded,Y,2014-07-03 00:00:00,Y,Mozambique,MOZ,pycountry,2014,7,3,No
668,836,ARB/14/13,Elektrogospodarstvo Slovenije - razvoj in inzeniring d.o.o.,Y,Bosnia and Herzegovina,Pending,Y,2014-06-16 00:00:00,Y,Bosnia and Herzegovina,BIH,pycountry,2014,6,16,No
669,837,UNCT/14/2,Eli Lilly and Company,Y,Canada,Concluded,Y,2013-09-12 00:00:00,Y,Canada,CAN,pycountry,2013,9,12,No
670,838,ARB/14/12,InfraRed Environmental Infrastructure GP Limited and others ,Y,Kingdom of Spain ,Concluded,Y,2014-06-03 00:00:00,Y,Spain,ESP,pycountry,2014,6,3,No
671,841,ARB/14/11,NextEra Energy Global Holdings B.V. and NextEra Energy Spain Holdings B.V.,Y,Kingdom of Spain,Concluded,Y,2014-05-23 00:00:00,Y,Spain,ESP,pycountry,2014,5,23,No
672,843,ARB/14/10,"Highbury International AVV, Compañía Minera de Bajo Caroní AVV, and Ramstein Trading Inc.",Y,Bolivarian Republic of Venezuela,Concluded,Y,2014-05-19 00:00:00,Y,"Venezuela, Bolivarian Republic of",VEN,pycountry,2014,5,19,Yes
673,844,ARB/14/9,"City-State N.V., Praktyka Asset Management Company LLC, Crystal-Invest LLC and Prodiz LLC",Y,Ukraine,Concluded,Y,2014-04-24 00:00:00,Y,Ukraine,UKR,pycountry,2014,4,24,No
674,846,ARB(AF)/14/1,Anglo American PLC,Y,Bolivarian Republic of Venezuela,Concluded,Y,2014-04-10 00:00:00,Y,"Venezuela, Bolivarian Republic of",VEN,pycountry,2014,4,10,Yes
675,847,ARB/14/8,CEAC Holdings Limited,Y,Montenegro,Concluded,Y,2014-03-20 00:00:00,Y,Montenegro,MNE,pycountry,2014,3,20,Yes
676,849,ARB/14/7,African Petroleum Gambia Limited (Block A4),Y,Republic of The Gambia,Concluded,Y,2014-03-12 00:00:00,Y,Gambia,GMB,pycountry,2014,3,12,Yes
677,850,ARB/14/6,African Petroleum Gambia Limited (Block A1),Y,Republic of The Gambia,Concluded,Y,2014-03-12 00:00:00,Y,Gambia,GMB,pycountry,2014,3,12,Yes
678,851,ARB/14/5,Infinito Gold Ltd.,Y,Republic of Costa Rica,Concluded,Y,2014-03-04 00:00:00,Y,Costa Rica,CRI,pycountry,2014,3,4,Yes
679,853,ARB/14/4,"Unión Fenosa Gas, S.A.",Y,Arab Republic of Egypt,Concluded,Y,2014-02-27 00:00:00,Y,Egypt,EGY,pycountry,2014,2,27,Yes
680,855,ARB/14/3,"Blusun S.A., Jean-Pierre Lecorcier and Michael Stein",Y,Italian Republic,Concluded,Y,2014-02-21 00:00:00,Y,Italy,ITA,pycountry,2014,2,21,No
681,857,ARB/14/2,Michael Dagher,Y,Republic of the Sudan,Concluded,Y,2014-02-21 00:00:00,Y,Sudan,SDN,pycountry,2014,2,21,No
682,858,ARB/14/1,Masdar Solar & Wind Cooperatief U.A.,Y,Kingdom of Spain,Concluded,Y,2014-02-11 00:00:00,Y,Spain,ESP,pycountry,2014,2,11,No
683,861,ARB/13/38,"Fouad Alghanim & Sons Co. for General Trading & Contracting, W.L.L. and Fouad Mohammed Thunyan Alghanim",Y,Hashemite Kingdom of Jordan ,Concluded,Y,2013-12-24 00:00:00,Y,Jordan,JOR,pycountry,2013,12,24,No
684,863,ARB/13/37,"Utsch M.O.V.E.R.S. International GmbH, Erich Utsch Aktiengesellschaft, and Helmut Jungbluth",Y,Arab Republic of Egypt,Concluded,Y,2013-12-24 00:00:00,Y,Egypt,EGY,pycountry,2013,12,24,No
685,864,ARB/13/36,Eiser Infrastructure Limited and Energía Solar Luxembourg S.à r.l.,Y,Kingdom of Spain,Pending,Y,2013-12-23 00:00:00,Y,Spain,ESP,pycountry,2013,12,23,No
686,869,ARB/13/35,UP and C.D Holding Internationale,Y,Hungary,Concluded,Y,2013-12-23 00:00:00,Y,Hungary,HUN,pycountry,2013,12,23,No
687,871,ARB/13/34,Courts (Indian Ocean) Limited and Courts Madagascar S.A.R.L.,Y,Republic of Madagascar,Concluded,Y,2013-12-23 00:00:00,Y,Madagascar,MDG,pycountry,2013,12,23,No
